vendor_name,item_names
,Canadian Club Whisky Mini; Monte Alban Silver; Grey Goose VX; Dekuyper Blood Orange; 99 Oranges; Connemara 12 Year; Connemara 12YR
10TH MOUNTAIN WHISKEY & SPIRIT COMPANY,10th Mountain Bourbon
3 BADGE CORPORATION,SOOH Uncle Vals Botanical Gin; Uncle Val's Restorative Gin; Kirk & Sweeney 12YR Old Anejo; Bozal Borrego Mezcal; Bozal Cuishe Mezcal; Bozal Tobasiche Mezcal; Uncle Vals Peppered Gin; Bozal Castilla Reserva Mezcal; Kirk & Sweeney 18YR; Kirk & Sweeney 23YR; Uncle Vals Restorative Gin; Bozal Ensamble Mezcal; Kirk & Sweeney Gran Reserva Superior Dominican Rum; Bozal Barril Mezcal Reserva; Bozal Cenizo Mezcal
3 BADGE MIXOLOGY,Uncle Val's; Masterson's 10YR Straight Rye; Uncle Val's Botanical Gin; Kirk & Sweeney; Kirk & Sweeney 12YR Old Anejo; Bib & Tucker Small Batch Bourbon Aged 6YR; Uncle Val's Restorative Gin; Masterson's 10yr Straight Rye
"3-OAKS DISTILLERY, LLC",3-Oaks Distillery Whiskey; 3-Oaks Distillery Straight Bourbon Whiskey
45TH PARALLEL SPIRITS,New Richmond Rye; 45th Parallel Vodka; Border Bourbon; Midwest Gin; Midwest Vodka; Gamle Ode Celebration Aquavit; Gamle Ode Holiday
"A HARDY / U.S.A., LTD.","Brown Jug Bourbon Cream; Cinnabon Cinnamon; Michael Godard ""Mr. Smooth""; Thatcher Blood Orange; Thatchers Elderflower; Skinos; Hardy Vsop Cognac; Hardy VS Cognac; Millars Special Reserve; Thatchers Apple Spice Ginger"
A HARDY USA LTD,Brown Jug Bourbon Cream; Cinnabon Cinnamon; Thatchers Cucumber Organic Liqueur; Thatchers Elderflower; Hyde 10YR Irish Whiskey Oloroso Sherry Finish; Vizcaya Black Rum; Hyde Irish Whiskey 6YR Bourbon Finish Cask
A V BRANDS INC,Ocean Organic Vodka Mini; Prichards Peach Mango Rum; Ocean Organic Vodka
"ADAMBA IMPORTS INT'L, INC.",Vesica Vodka
AHA TORO SPIRITS INC,Aha Yeto Anejo Tequila; Aha Yeto Blanco Tequila; Aha Yeto Reposado Tequila
AHA TORO SPIRITS INC / AHA YETO TEQUILA,Aha Yeto Blanco Tequila; Aha Yeto Anejo Tequila; Aha Yeto Reposado Tequila
AIKO IMPORTERS INC,La Collection Football; Morrigan; La Collection Flag; La Collection $100 Banknote; La Collection Santa Claus; La Collection Race Car; La Collection Tiger Blue; La Collection Tiger; La Collection Fish; La Collection Musician; Lawless; Sensei; Lohin McKinnon Single Malt; Cruxland Gin; Original Gangster XO; Cleopatra XO; Five Star Pegasus; Five Star Turtle; Five Star Pirate Sword; After All Brownie; After All Tiramisu; Giori Lemoncillo; Regalia; Five Star Horse; After All Chocolate; After All Lemon Cheesecake; Old Barrel; Le Prince D' Oranges; La Collection Shoe; La Collection Viking Ship
ALLEGHENY DISTILLING LLC,"Maggie's Farm ""50/50"" Dark Rum; Maggie's Farm Spiced Rum"
ALTAMAR BRANDS LLC,Tequila Ocho Reposado; FOURSQUARE 2007 Single Blended Rum; Ch�teau Arton FINE BLANCHE Armagnac; Tequila Ocho Plata; Tequila Ocho Anejo; FOURSQUARE Sagacity DISCO; FOURSQUARE 2007 Single Blended Rum DISCO; FOURSQUARE Sagacity
"AMERICAN HERITAGE DISTILLERS, LLC",Century Farms Prairie States Unaged Corn Whiskey; Century Farms Prairie States Unaged High Proof Corn Whiskey; Century Farms Prairie States Corn Whiskey Rapid Aged; Century Farms Open Gate Vodka; Century Farms Prairie States Bourbon; Century Farms Corn Whiskey; Century Farms Bourbon
"AMERICAN HERITAGE DISTILLERS, LLC / CENTURY FARMS DISTILLERY",Century Farms Prairie States Corn Whiskey Rapid Aged; Century Farms Prairie States Unaged High Proof Corn Whiskey; Century Farms Open Gate Vodka
AMERICAN SPIRITS EXCHANGE,E.T. 51 Premium Vodka; E.T.51 Premium Vodka Mini; E.T. 51 Premium Whisky; E.T.51 Espresso Flavored Vodka; Letherbee Fernet; Adelaides Caramel Mocha Mojo; Adelaides Caramel Mocha Mojo Mini; E.T. 51 Premium Vodka Mini; Letherbee Gin; E.T. 51 Espresso Flavored Vodka; Resilient Bourbon Whiskey; Adelaides Coconut Liqueur Mini; Letherbee Original Recipe Besk; Adelaides Coconut Liqueur; Bearded Lady Bourbon; Resilient Bourbon Whiskey (Barrel Strength); Siempre Tequila Plata
AMERICAN VINTAGE BEVERAGE,TGIFridays Ultimate Orange Dream; TGIFridays Long Island Iced Tea; TGIFridays Ultimate Mudslide; TGIFridays Classic Margarita; TGIFridays Strawberry Margarita; TGIFridays Barbados Rum Punch
ANCHOR DISTILLING,Barsol Selecto Italia Pisco; Westland Sherry Wood Single Malt; Kavalan King Car Conductor; Junipero Gin; No. 3 London Dry Gin; Luxardo Maraschino Cherry; Nikka Coffey Grain Whiskey; D'aristi Xtabentun; The Glenrothes Bourbon Cask Reserve; Hine Rare Vsop Cognac; Chinaco Anejo Tequila; Curacao Of Curacao Orange; Barsol Primero Quebranta Pisco; Westland American Single Malt; Kavalan Sherry Oak Single Malt; Old Potrero Rye; Kavalan ex-Bourbon Oak Single Malt; Nikka Pure Malt; Kavalan Concertmaster; Westland Peated Single Malt
ANCHOR DISTILLING (PREISS IMPORTS),"Kavalan Classic Single Malt Whiskey; Glendronach 15yo; Nikka Pure Malt; Glenrothes 1998; Glendronach 12YR Original; Nikka Yoichi 15 Yr Single Malt; Kavalan King Car Conductor; The Glenrothes Bourbon Cask Reserve; Lonach Blended Scotch 1973 36yr; Glendronach 12yo; Chinaco Anejo Tequila; Chinaco Reposado Tequila; Glenrothes Alba Reserve; Junipero Gin; No. 3 London Dry Gin; Hirsch Small Batch Bourbon; English Harbour Rum 5yr; Luxardo Maraschino; Luxardo Morlacco Cherry Liqueur; Barsol Primero Quebranta Pisco; Luxardo Maraschino Cherry; Cachaca 21; Toucano Rum; F. Meyer Pear Eau De Vie; Westland American Single Malt; Nikka Taketsura 21 Yr, Pure Malt; Karlssons Gold Vodka; Kavalan Concertmaster; Glenrothes 1995; Westland Peated Single Malt; Glendronach 14yr Virgin Oak - DNO; Berry's Own 11yr St. Lucian Rum; Glenrothes 1988; Hine Rare Vsop Cognac; Luxardo Limoncello; Luxardo Limoncello Frosted; Ypioca Cachaca Crystal; Hophead Hopped Vodka; Nikka Coffey Grain Whiskey; Slieve Foy Irish Whiskey; Benriach Curiositas 10yr Single Malt; Chinaco Blanco Artisan Tequila; Westland Sherry Wood Single Malt; Glenrothes 2001; Berry's Own 8yr Grenada Rum; Ypioca Ouro; Dt Blackbull 30yr Blended Whisky; Chateau Du Busca Xo No.1; Hirsch Straight Bourbon Small Batch; Ypioca Cachaca Prata; Xtabentun; Luxardo Amaro Abano; Anchor Old Tom Gin; Anchor Old Potrero 18th Century Rye; Cadenheads Lowland; Inchmurrin 12 Yr; Dt Lonach Glendarroch 1966 42yr; Dt Blackbull 12yr; Genevieve Gin; D'aristi Xtabentun; Nikka Taketsuru 17 yr, Pure Malt; Glendronach 15yr Pedro Ximinez Sherry Pucheon; Christian Drouin Calvados Selcetion; The Kings Ginger; Littlemill 12yr; Old Potrero Rye; Berry's Own 10yr Panama Rum; Curacao Of Curacao Orange; Nikka Miyagikyo 12 Year Single Malt Why.; Kavalan ex-Bourbon Oak Single Malt; Mezcal Amaras; Hazelburn 12 Yr; Glendronach 18yo; English Harbour Rum 10yr; Kalani Coconut Liqueur; Licor De Nance; Penny Blue XO Rum; Kavalan Ex-Bourbon; Glenrothes 94; Don Cesar Pisco Puro; Berry's Own 9yr Fiji Rum; Kavalan Sherry Oak Single Malt; Dt Nc2 1993 Aberlour 16yr; Berry's Own 12yr Guadaloupe Rum; Barsol Supremo Moste Verde Italia Pisco"
ANHEUSER-BUSCH/LONGTAIL LIBATIONS,Purus Organic Vodka Mini
ARTISAN GRAIN DISTILLERY,Artisan Grain Original Moonshine; Artisan Grain Gold Rum; Artisan Grain Silver; Artisan Grain Silver Rum
"ASDSPIRITS, LLC",The Anejo by Porfidio
AVENIU BRANDS,Prichard's Lincoln County Lightning; Ocean Organic Vodka; Prichard's Rye; Kah Tequila Blanco Mini; Kah Tequila Blanco; Kah Tequila Anejo; Kah Reposado; Kah Anejo; Kah Blanco Tequila; Prichard's Sweet Lucy Cream; Prichard's Fudge Brownie Cream Liqueur; Prichard's Sweet Lucy; Prichard's Double Chocolate Bourbon; Prichard's Double Barreled; Prichard's Fine Rum; KAH Tequila Reposado; Prichard's Crystal Rum; Ocean Organic Vodka Mini; Prichard's Sweet Lucy Bourbon Cream Liqueur; Prichard's Single Malt Whiskey; Kah Tequila Reposado Mini; Prichard's Tennessee Whiskey; Prichard's Sweet Georgia Belle Rum; Kah Tequila Anejo Mini
B. T. O. DISTILLERS LLC,Bluestem Vodka
"BACARDI U.S.A., INC.",Bacardi Multi-Flavor Mini 6 Pack; Grey Goose w/2 Glasses & Shaker; Grey Goose w/2 Martini Glasses; Drambuie w/Pitcher; Grey Goose Night Vision; DiSaronno Amaretto Glass Pack; Aberfeldy 12 Year Single Malt Scotch; Bacardi Oakheart w/Stein; Bacardi 8 Gift Box; St. Germain w/Carafe; Leblon Cachaca; Bombay Sapphire w/Glass; Bacardi Gold Rum PET; D'usse VSOP; Aberfeldy 21 Year Single Malt Scotch; Bacardi 8 w/2 Glasses; Cazadores Reposado; Cazadores Blanco; Cazadores Anejo; Corzo Silver; Corzo Anejo Tequila; Bacardi Oakheart PET; Bacardi Oakheart; Castillo Spiced Rum; Bacardi Oakheart Mini; Bacardi Limon; Bacardi Dragon Berry; Bacardi O; Bacardi Black Razz; Bacardi Peach Red; Bacardi Torched Cherry; Bacardi Pineapple Fusion; Bacardi Dragonberry; Bacardi Razz; Bacardi Mango Fusion; Bacardi Wolf Berry; Bacardi Rock Coconut; Bacardi Pineapple; Bacardi Raspberry; Bacardi Dragon Berry PET; Bacardi Grapefruit; Bacardi Arctic Grape Liqueur; Bacardi Pineapple Fusion PET; Bacardi Tangerine; Bacardi Coco; Bacardi Black; Bacardi Mango; Bacardi Grand Melon Rum; Bacardi Tangerine Mini; Bacardi Mango Fusion Mini; Grey Goose Vodka; Grey Goose Multi Pack; Grey Goose Vodka Mini; Grey Goose Le Citron; Grey Goose VX; Dewars White Label Scotch; Dewar's White Label Scotch Mini; Dewar's White Label Scotch; Dewars Highlander Honey; Dewars 12yr; Dewar's 18yr; Dewar's White Label Scratched Cask; Bombay Sapphire Gin; Bombay Sapphire East; Bombay Dry Gin; Bombay Original Gin; Bombay Sapphire Gin Mini; Oxley Dry Gin; Bacardi Party Drinks Zombie; Bacardi Classic Cocktails Mojito; Bacardi Party Drinks Hurricane; Bacardi Party Drinks Bahama Mama; Bacardi Party Drinks Rum Island Iced Tea; Bacardi Classic Cocktails Strawberry Daiquiri; Bacardi Classic Cocktails Pina Colada Light; Bacardi Cocktails Strawberry Daiquiri Light; Bacardi Cocktails Pina Colada; Bacardi Cocktails Mojito Light; Bacardi Rum Runner; Bacardi Classic Cocktails Pina Colada; Bonnie Rose Orange Peel; Bonnie Rose Spiced Apple Mini; Bonnie Rose Orange Peel Mini; Bonnie Rose Spiced Apple; Grey Goose Le Melon Mini; Grey Goose Le Melon; Grey Goose Cherry Noir; Grey Goose La Poire Vodka; Grey Goose Vodka L'orange; Grey Goose La Poire Mini; Grey Goose Le Citron Mini; Bacardi Superior Rum; Castillo Silver Rum; Bacardi Superior Rum Pet; Bacardi Superior PET; Bacardi Gold Rum; Bacardi Superior Rum Mini; Bacardi Select Rum; Bacardi 151 Proof Rum; Bacardi Gold Rum Mini; Bacardi Anejo Mex Rum; Bacardi Gold Rum Pet; Bacardi 8 Rum; Bacardi Gran Reserva Maestro; Bacardi 151 Prf; Castillo Gold Rum; Bacardi Light Rum; St. Germain; St Germain; St. Germain Mini; B&b D.o.m.; Benedictine Liqueur Dom; St. Germain .750ml; Nassau Royale; Drambuie 15yr; Aberfeldy 16YR w/2 Glasses & Ice Mold; Craigellachie 13YR Single Malt; St Germain w/Mini Carafe; Corzo Reposado Tequila; Seven Tiki Spiced Rum; Eristoff Vodka; Grey Goose La Poire Vodka(pear); Bacardi Classic Cocktails Strawberry Daiquiri Light; Grey Goose With Shaker; Corzo Silver Tequila; Bacardi Big Apple Rum; Bacardi Limon Mini; Bombay Gin; Bacardi 1873 Solera; Bacardi Big Apple Flavored Rum; Dewar's 15 Yr Old; Bombay Sapphire Gin Minis; Bacardi 151 Rum; Grey Goose L'Orange; Grey Goose La Poire; Bacardi Black Razz Miniature; Bacardi O Rum
BACARDI USA INC,Grey Goose Vodka; Bacardi Gold Mini; Bacardi Gold Rum; Bacardi Anejo Cuatro; Bacardi Gold; Bacardi Gold Rum PET; Grey Goose Night Vision; Bacardi Gold PET; Grey Goose Vodka Mini; Bacardi Black; Bacardi Gold Rum Mini; SOOH Benedictine Liqueur Dom; Royal Brackla 12 Yr; Bacardi O DISCO; Bacardi Gold Rum Pet; Leblon Cachaca; Benedictine Liqueur Dom; D'usse VSOP; Bacardi 8 Rum; Havana Club Anejo Clasico; Bacardi Gran Reserva Maestro; Corzo Silver Tequila; Bacardi Coco; Bacardi Gran Reserva Diez; Aberfeldy 12YR; Cazadores Reposado; SOOH Pyrat XO Reserve; Bacardi 8; Patron XO Cafe; Aberfeldy 21 Year Single Malt Scotch; HA Aberfeldy 18yr Single Malt; HA Craigellachie 17YR Single Malt; HA Aultmore 21YR Single Malt; HA Aberfeldy 20 YR Single Malt; HA Craigellachie 13YR Single Malt; Craigellachie 13YR Single Malt; Havana Club Anejo Clasico Mini; HA Aberfeldy 16YR Single Malt; HA Aberfeldy 21YR Single Malt; Corzo Anejo Tequila; Banks 7 Golden Blend; Aberfeldy 12 Year Single Malt Scotch; Bacardi Superior PET; Bacardi Superior; Bacardi Superior Mini; Castillo Silver Rum; Bacardi Superior Rum; Bacardi Superior Rum Mini; Havana Club Anejo Blanco; Bacardi Superior Rum Pet; Havana Club Anejo Blanco Mini; Santa Teresa 1796 Solera Rum; Bacardi Spiced Rum; Bacardi Oakheart; Castillo Spiced Rum; BACARDI SPICED RUM; Bacardi Oakheart Mini; Bacardi Limon; Bacardi Lime; Bacardi Dragon Berry; Bacardi Tangerine; Bacardi Lime Mini; Bacardi O; Bacardi Pineapple Fusion; Bacardi Raspberry; Bacardi Classic Cocktail Rum Punch; Bacardi Mango Fusion; Bacardi Tangerine DISCO; Bacardi Banana; Bacardi Mango; Bacardi Torched Cherry DISCO; Bacardi Pineapple; Bacardi Grapefruit; BACARDI COCO; BACARDI DRAGONBERRY; Bacardi Banana Mini; Bacardi Zombie RTS; Bacardi Classic Cocktails Strawberry Daiquiri; Bacardi Party Drinks Hurricane; Bacardi Classic Cocktails Mojito; Bacardi Party Drinks Bahama Mama; Bacardi Island Tea RTS; Bacardi Mojito RTS; Bacardi Bahama Mama RTS; Bacardi Party Drinks Zombie; Bacardi Party Drinks Rum Island Iced Tea; Bacardi Rum Punch RTS; Bacardi Hurricane RTS; Bacardi Classic Cocktails Rum Punch; Bacardi Island Punch; Teeling Small Batch Irish Whiskey; Teeling Single Grain; Grey Goose Mini; Grey Goose; Grey Goose Essences Watermelon & Basil Mini; Grey Goose VX; Grey Goose Essences Watermelon & Basil; Grey Goose Strawberry & Lemongrass; Grey Goose Essences Strawberry & Lemongrass Mini; Grey Goose Essences White Peach & Rosemary Mini; Grey Goose Essences White Peach & Rosemary; Dewars White Label Scotch; Dewars 12YR; Dewars 12yr; Dewars White Label Mini; Dewars Caribbean Smooth; Dewars Mezcal 8 YR; Dewar''s Mezcal 8 YR; Dewars Double Double Aged 21 YR; Dewar's White Label Scratched Cask DISCO; HA Angels Envy Cask Strength; Bosford Rose Gin; Bosford Rose Gin Mini; Bombay Sapphire Gin; Bombay Sapphire; Bombay Dry Gin; Bombay Sapphire East; Bombay Sapphire Mini; Oxley London Dry Gin; Bombay Bramble; Patron Silver Mini; Patron Silver; Patron Anejo; Patron Reposado; Cazadores Blanco; Patron Rainbow Pack; Cazadores Tequila Blanco; Cazadores Anejo; Patron Extra Anejo; Plume & Petal Lemon Drift; Plume & Petal Cucumber Splash; Plume & Petal Peach Wave; Grey Goose La Vanille; Grey Goose Le Citron; Grey Goose Le Melon; Grey Goose La Poire Vodka; Grey Goose Cherry Noir; Grey Goose Vodka L'orange; Grey Goose La Poire; Grey Goose L'Orange; Angels Envy Bourbon Port Finished; Angel's Envy Bourbon Port Finished; St Germain; St. Germain; B&b D.o.m.; Patron Citronge; B&B DOM; St. Germain Liqueur; Patron Citronge Pineapple; St Germain w/2 Glasses & Stirrers; Grey Goose w/2 Martini Glasses; Grey Goose w/Shaker; BOMBAY SAPPHIRE WITH TONIC PACK; Patron Silver Special Tin; Dewars 200ml Variety Pack; Bacardi Reserva Ocho & Diez Pack; FLAVORED RUMS MULTI PACK; Patron Silver w/2 Mule Mugs; Cazadores Blanco w/Shaker; CAZADORES REPOSADO WITH MARGARITA MIX; Teeling Trinity Pack; Bacardi Tropical; Bombay Sapphire Gift Tin; Grey Goose w/2 Martini Glasses DISCO; Dewars w/Glass & Ice Mold; Bacardi 8YR w/Glass & Ice Mold; Bacardi Coquito; Grey Goose Original Flour Tin; Angels Envy Rye; Dewars 15YR w/2 Rock Glasses; Bacardi Ocho Mixing Glass & Spoon Pack; ANGELS ENVY RYE; Dewar's Portuguese Smooth; Dewars 12YR w/2 Rock Glasses; Dewars Portuguese Smooth; Dewars 12 w/2 Rock Glasses; Dewars 12YR with Ginger Ale Pack; Cazadores Reposado w/2 Shot Glasses; DEWAR''S 12 YR WITH GINGER ALE PACK; St Germain Liqueur Mini; Bacardi Anejo Mex Rum; Bacardi 1873 Solera; Bacardi Torched Cherry; Teeling Single Malt; Dewars 8YR Mezcal DISCO; Bombay Bramble Mini; Grey Goose La Vanille DISCO; Corzo Reposado Tequila; Bombay Sapphire Gin Minis; Bacardi Superior - use code 43831; Angel's Envy Port Finished; Oakheart Spiced Rum; Dewar's White Label Scotch Mini; Bacardi Limon Mini; Bacardi Gran Reserva Diez Rum; Facundo Eximo; Banks 5  Island Blend; Dewar's White Label Scratched Cask; Banks 5 Island Blend; Ultimat Vodka; Bacardi Rum Runner; Cedilla; Oxley Dry Gin; Cazadores Reposado Reservado Buy the Barrel; Facundo Paraiso; Patron Roca Reposado; Patron Extra Anejo 10 Anos; Cazadores Anejo Cristalino; Grey Goose Le Melon DISCO; Stillhouse Classic Vodka; 42 Below Pure Vodka; Patron Reposado Barrel Select Program
BACMAR INTERNATIONAL,Voyant
BAD BEAR ENTERPRISES,Iowa Legendary Rye Unaged
BAD BEAR ENTERPRISES LLC,Special Order Iowa Legendary Rye Black Label; Special Order Iowa Legendary Rye Red Label; Iowa Legendary Rye Aged; Iowa Legendary Rye Black Label; Ziyad White Rye; Iowa Legendary Rye Private Reserve; Iowa Legendary Rye White Label; Iowa Legendary Rye Red Label; Iowa Legendary Rye Aged DISCO; Iowa Legendary Rye Vodka; Iowa Legendary Rye Unaged; Iowa Legendary Rye Private Reserve DISCO; Ziyad White Rye DISCO; Iowa Legendary Rye Unaged DISCO; Special Order Iowa Legendary Rye White Label; Iowa Legendary Rye Purple Label
BAD BEAR ENTERPRISES LLC / LEGENDARY RYE,Iowa Legendary Rye Black Label; Iowa Legendary Rye White Label; Iowa Legendary Rye Red Label; Iowa Legendary Rye Vodka; Special Order Iowa Legendary Rye Red Label; Special Order Iowa Legendary Rye Black Label
BARREL HOUSE DISTILLING CO.,Devil John Moonshine # 9
"BELMONT FARMS OF VA., INC",Virginia Moonshine
BENDISTILLERY,Crater Lake Vodka; Crater Lake Gin; Crater Lake Reserve Vodka; Crater Lake Hazelnut
BEST CASE WINES LLC,"SOOH Calvados Morin Selection; Calvados Morin ""Selection""; Millet Armagnac XO; SOOH Millet Armagnac VSOP; SOOH Millet Armagnac XO; SOOH Millet Armagnac VS; SOOH Morin Calvados VSOP; Calvados Morin Selection; Charles Baur Fine d'Alsace; Morin Calvados Hors d'Age; SOOH Charles Baur Poire William; Millet Armagnac VS; Charles Baur Fine d''Alsace; Charles Baur Poire William; Morin Calvados VSOP; SOOH Morin Calvados Hors d'Age; Roger Groult Calvados 8YR - DNO; Calvados Morin Selection 3YR; Calvados Morin 1973; Millet Armagnac VSOP"
BETTER BRANDS BEV CO,Salute American Vodka
"BIAGIO CRU AND ESTATE WINES, LLC",O'Dowd's Pumpkin Spice; O'dowd's Pumpkin Spice
BLACK DIRT DISTILLERY,Black Dirt Bourbon
BLACK ROCK SPIRITS,Bakon Vodka; Bakon Rosemary Vodka; Bakon; Bakon Sports Box Bloody Mary Kit; Bakon Rosemary
"BLACK SEA IMPORTS, INC",Putinka Limited Edition
BLAUM BROS. DISTILLING CO.,Lead Mine Moonshine; Blaum Bros. Vodka; HellFyre; Blaum Bros. Gin
BLAUM BROTHERS DISTILLING CO,Blaum Bros. Vodka; Blaum Bros. Gin; HellFyre; Knotter Bourbon; Oldfangled Knotter Bourbon 10YR
BLUFF CREEK DISTILLERY,Y-not Vodka; Fire in the Hole Cinnamon Vodka
BMC IMPORTS,Jewel Of Russia Ultra; Jewel Of Russia Classic
"BOFFO BRANDS, LLC",Prairie Wolf Dark; NutLiquor Peanut Butter Vodka; Sinfully Thinn Blueberry Light Whiskey; Sinfully Thinn Cinnamon Light Whiskey
BOM DIA IMPORTS LLC,Novo Fogo Silver Cacha�a
BOOT HILL DISTILLERY LLC,Boot Hill Distillery Red Eye Whiskey; Boot Hill Distillery Vodka
BOSTON BEER COMPANY,Sam Adams Utopias HA
BRECKENRIDGE DISTILLERY,SOOH Breckenridge Bourbon; Breckenridge Vodka; Breckenridge Spiced Rum; Breckenridge Bourbon; Breckenridge Bourbon HA; Breckenridge Distillers High Proof Blend Bourbon; Breckenridge Bourbon(do Not Use); Breckenridge Bitters; Breckenridge Whiskey Port Cask Finish; Breckenridge Espresso Vodka; HA Breckenridge Whiskey Distilled from Malt Mash Dark Arts
BREUCKELEN DISTILLING,77 Whiskey New York Wheat
BROADBENT DISTILLERY,Hot Lil' Hooch Cherry Cinnamon Whiskey; Two Jay's Country Style Blended Why.; Two Jay's Iowa Corn Whiskey; Two Jay's Grappa; Itty Bitty Juggs Sample Pack; Juggs Cherry Cha-Chas; Bella Limoncello; Juggs Cherry Cha-Cha's; Juggs Strawberry Sistas; Bella Orangecello; Juggs Blueberry Bazoombas; Two Jay's Urban Style Light Whiskey
BROADBENT VENTURES LLC,Hot Lil' Hooch Cherry Cinnamon Whiskey; Two Jay's Urban Style Light Whiskey; Two Jay's Country Style Blended Why.; Two Jay's Iowa Corn Whiskey; Two Jays Country Style Blended Whiskey; Two Jay's Grappa; Juggs Cherry Cha-Cha's; Itty Bitty Juggs Sample Pack; Bella Limoncello; Juggs Strawberry Sistas; Juggs Blueberry Bazoombas; Two Jays Iowa Corn Whiskey; Two Jays Grappa
BROADSLAB DISTILLERY,Broadslab Legacy Shine
BROWN FORMAN CORP.,Woodford Reserve Rye; Chambord Liqueur Minis; Jack Daniels Tennessee Rye; SOOH Jack Daniels Sinatra; SOOH Early Times Bottled in Bond; Finlandia Vodka 80 Proof; Old Forester 1920; Chambord Liqueur w/2 Glasses; Old Forester 1897 Whisky Row Series; Jack Daniel's Hispanic w/2 Glasses; Gentleman Jack w/2 Glasses; Woodford Reserve w/2 Glasses; Don Eduardo Reposado; Woodford Reserve Straight Malt; Jack Daniels Single Barrel w/Snifter Glass; SOOH Finlandia Vodka 80 Proof; HA Jack Daniel's Single Barrel Rye Barrel Proof; HA Jack Daniels Single Barrel Eric Church; Finlandia Vodka Raspberry; Jack Daniel's Sinatra Select Whiskey; Early Times Bottled in Bond; HA Old Forester Birthday Bourbon 2017; HA Benriach 10YR Curiositas; HA Glendronach 12YR Original; HA Glendronach 18YR Allardice; SOOH Old Forester 1920; HA Benriach 10YR; GlenGlassaugh Evolution; Finlandia Vodka Grapefruit; Slane; HA Slane Irish Whiskey; Korbel Brandy Pet; Korbel Brandy; Korbel Brandy PET; Korbel Brandy VSOP; Canadian Mist Whisky; Canadian Mist Whisky PET; Canadian Mist Whiskey Pet; Canadian Mist Canadian Why Pet; El Jimador Reposado Tequila; El Jimador Silver Tequila; Herradura Sliver; Herradura Reposado; El Jimador Silver; El Jimador Reposado; Herradura Anejo; Herradura Gold Reposado 6pak; Herradura Anjeo; Herradura Silver; Antiguo Anejo; El Jimador Anejo Tequila; Don Eduardo Silver Tequila; El Jimador Anejo; Pepe Lopez Gold; Herradura Selection Suprema; Jack Daniels Old #7 Black Lbl; Jack Daniels Old #7 Black Label; Jack Daniels Old #7 Black Label Mini; Jack Daniels Tennessee Fire Mini; Jack Daniels Tennessee Honey; Jack Daniels Old #7 Black Label Square; Jack Daniels Tennessee Honey Mini; Jack Daniels Old #7 Black Label Flat; Gentleman Jack; Jack Daniels Single Barrel Personal Collection Buy the Barre; Jack Daniels Old #7 Black Lbl Square; Jack Daniel's Tennessee Honey; Jack Daniels Tennessee Fire; Jack Daniels Old #7 Black Lbl Flat; Jack Daniels Black Label; Jack Daniel's Tennessee Fire; Jack Daniels Tennessee Apple Mini; Jack Daniels Tennessee Apple; Jack Daniels Old #7 Black Lbl Mini; Jack Daniels Single Barrel Personal Collection; Jack Daniels Single Barrel; Jack Daniels 27 Gold; Jack Daniel's Tennessee Honey Mini; Jack Daniel's Tennessee Fire Mini; Jack Daniel's 4YR Rye Single Barrel; Jack Daniel's Single Barrel Barrel Proof; Jack Daniels Winter Jack; Jack Daniels 4YR Rye Single Barrel; Jack Daniels Tennessee Fire w/2 Glasses; Jack Daniels TN Honey w/NBA Basketball Ice Mold; Jack Daniels Tennessee Honey w/NBA Basketball Ice Mold; HA Jack Daniels Single Barrel SR Heritage; Jack Daniels Single Barrel Barrel Proof; SOOH Jack Daniels Single Barrel Barrel Proof; Jack Daniels w/Glass; Old Forester Mint Julep; Old Forester Signature 100prf Bourbon; Woodford Reserve; Early Times 36 Mo Ky Str Bourbon PET; Woodford Reserve Double Oaked; Woodford Reserve Bourbon; Old Forester Bourbon 86prf; Early Times 36 Mo Ky Str Bourbon Pet; Woodford Reserve Straight Bourbon; Old Forester; Old Forester Bourbon; Old Forester 1910; SOOH Old Forester 1910; Early Times 36 Mo Ky Str Bourbon; Woodford Reserve Mini; Old Forester Statesman; Old Forester 1870 Whisky Row Series; HA Old Forester Birthday Bourbon 2020; Woodford Reserve w/Glass; HA Woodford Reserve Batch Proof; HA Woodford Reserve Straight Wheat; Chambord Liqueur Royale De France; Woodford Reserve Kentucky Derby 2020; Jack Daniels Tennessee Fire w/Shot Glass Mold; Jack Daniel''s Holiday Calendar Pack; Old Forester Twin Pack; Gentleman Jack w/Stainless Steel Cup; Woodford Reserve Kentucky Derby 2019; Jack Daniels TN Fire w/2 Glasses; Gentleman Jack w/ Coaster Set; Jack Daniel's TN Honey w/Flask; Jack Daniels TN Honey w/Glass; Jack Daniel's TN Fire w/2 Glasses; Jack Daniel's Grill Out w/2 Rock Glasses; Jack Daniels Legacy Edition 1905; Jack Daniel's w/2 Glasses; Jack Daniels Music Carton w/2 Glasses; Jack Daniel's Legacy; Old Forester Single Barrel Barrel Proof; Jack Daniels w/2 Glasses; Gentleman Jack w/Shaker; Jack Daniels Tennessee Honey w/2 Rocks Glasses; Old Forester OldFsh w/ 2oz Syrup; Jack Daniels TN Honey w/Flask; Woodford Reserve Kentucky Derby 2018; Jack Daniels Tennessee Rye w/2 Rocks Glasses; El Jimador Reposado w/Glass; El Jimador Silver w/Rocks Glass; Woodford Reserve W/ Mint Julep Cup; Jack Daniels Grill Out w/2 Rock Glasses; Woodford Reserve w/Mint Julep Cup; Herradura Silver w/Ice Mold; Jack Daniels Tennessee Honey w/Stir Sticks; Jack Daniels Sinatra; Jack Daniel's Single Barrel Buy the Barrel; HA Glendronach Peated; HA Benriach 12YR 2005 Cask#2683; HA Glendronach Parliament 21YR; Glendronach Parliament 21YR; Glendronach 18YR Allardice; Canadian Mist PET; Pepe Lopez Gold Tequila; Jack Daniels Single Barrel Mini; Jack Daniel's Winter Jack; Woodford Reserve Double Oaked Buy the Barrel; Old Forester Single Barrel Select BTB; Glenglassaugh Revival; Don Eduardo Anejo Tequila; Woodford Reserve Personal Selection Barrel; Old Forester Rye; Collingwood Canadian Why. DISCO; GlenDronach 15 Year Revival; Glendronach 12YR Original; Antiguo Reposado; Woodford Reserve Kentucky Derby 2016; Coopers Craft Kentucky Straight Bourbon Whiskey; Old Forester Single Barrel Select Buy The Barrel; Old Forester 4yr 86prf Bourbon; HA Benriach Cask Strength Batch 2; Coopers Craft Reserve Kentucky Straight Bourbon Whiskey; SOOH Glendronach 1993 Vintage; Gentleman Jack Mini; Coopers' Craft Reserve Kentucky Straight Bourbon Whiskey; GlenDronach Portwood NAS; Korbel Brandy XS; Glenglassaugh Torfa; Finlandia Mango Fusion; El Jimador Reposado Mini; Old Forester 100prf; Woodford Reserve Kentucky Derby 2017; Glendronach 18yo; BenRiach 12 Year; Glendronach Cask Strength
