vendor_name,item_names
LUXCO INC,Juarez Triple Sec; Paramount Gold Rum; Everclear 151; Pearl Plum; Juarez Gold Dss; Paramount Triple Sec; Juarez Gold DSS; La Prima Triple Sec; Hawkeye Vodka; Hawkeye Vodka 80 Prf Mini; Paramount Sloe Gin; Paramount Amaretto; Everclear Alcohol; Paramount Gold Rum PET; Arrow Creme de Cacao Brown; Paramount Gold Rum Traveler; Everclear 190prf; Pearl Strawberry Basil; Caffe Lolita Coffee Liqueur; Minor Case Straight Rye; Pearl Blueberry; Paramount Melon Liqueur DISCO; Pearl Plum Vodka; Ezra Brooks Rye; Pearl Red Berry; Colonial Club Blackberry & Brandy; Pearl Lime Basil Vodka; Paramount Creme de Menthe White DISCO; Paramount Rock & Rye DISCO; Rebel Yell Small Batch Rye; Paramount Gold 151 Rum; SOOH Celtic Honey Liqueur; SOOH Pearl Red Berry; SOOH Arrow Ginger Brandy; El Mayor Extra Anejo Rum Cask Finish Tequila; Salvador's Original Margarita PET; Korski Vodka; Pearl Cucumber Mini; Pearl Vanilla Bean Mini; Pearl Strawberry Basil Mini; Paramount Creme De Cacao/dark; Pearl Vodka; Paramount Creme De Menthe/green; Paramount Blue Curacao; Arrow Anisette; Paramount White Rum; Hawkeye Light Rum; Paramount White Rum PET; Paramount White Rum Traveler; Lady Bligh Spiced Rum; Lady Bligh; Juarez Silver; Juarez Tequila Gold; Juarez Gold; La Prima Tequila/gold; Juarez Tequila Silver; La Prima Gold; La Prima Tequila/white; La Prima White; Salvadors Margarita 4pk; Salvadors Classic Margarita 4pk Slim Cans; Salvadors Original Margarita PET; Paramount Long Island Iced Tea; Salvador's Margarita 4pak; Salvadors Original Margarita 4pk; Salvadors Top Shelf Strawberry Margarita; Salvador's Top Shelf; Salvadors Peach Margarita; Salvadors Spicy Lime Margarita; St Brendans Irish Cream; St. Brendan's Superior Irish Cream Liqueur; Ezra Brooks Bourbon Cream; Arrow Creme De Cassis; Arrow Creme de Cassis; The Quiet Man 8YR; The Quiet Man; Hawkeye Vodka Mini; Hawkeye Vodka PET; Paramount Vodka; Paramount Vodka 100prf; Pearl PET; Pearl Vodka PET; Pearl 80prf; Pearl; Pearl 80prf PET; Lord Calvert Spiced Peach Whisky Mini; Rebel Yell Ginger Whiskey; Rebel Yell Root Beer Whiskey; Rebel Yell Ginger Whiskey Mini; Rebel Yell Root Beer Whiskey Mini; Calvert Extra Bl Whiskey; Hawkeye Blended Whiskey; Calvert Extra Blended Whiskey; Calvert Extra Blend Whiskey; Hawkeye Blend Whiskey; Paramount Apricot Brandy; Paramount Blackberry Brandy; Arrow Apricot Flav Brandy; Arrow Blackberry Flav Brandy; Paramount Apricot Flavored Brandy; Arrow Blackberry Brandy; Arrow Apricot Brandy; Paramount Cherry Brandy; Arrow Wild Cherry Brandy; Paramount Peach Flavored Brandy; Arrow Wild Cherry Flav Brandy; Paramount Cherry Flavored Brandy; Paramount Peach Brandy; Paramount Gin; Hawkeye Gin; Arrow Gin; Calvert Gin; Bowling & Burch Gin; Arrow Peppermint Schnapps Mini; Paramount Peach Schnapps; Arrow Spearmint Schnapps; Paramount Peppermint Schnapps; Arrow Super Peppermint Schnapps Mini; Arrow Peppermint Schnapps; Arrow Super Peppermint Schnapps; Arrow Peach Schnapps; Arrow Raspberry Schnapps; Paramount Peppermint Schnapps PET; Paramount Strawberry Schnapps; Arrow Mcdales Butterscotch Schnapps; Paramount Peppermint Schnapps Traveler; Arrow Mcdale's Butterscotch Schnapps; Thunder 101 Peppermint Schnapps; Paramount Butterscotch Schnapps; Canadian Reserve Whisky; Hawkeye Canadian Whisky Mini; Hawkeye Canadian Whisky; Lord Calvert Canadian Whisky; Lord Calvert; Lord Calvert Hunting Dog Decanter Series 2; SOOH Lord Calvert; Stock 84 Brandy; Exotico Reposado; Exotico Blanco; Exotico Blanco 100% Agave Tequila; HA El Mayor Cask Finish 100% Agave Tequila; El Mayor Anejo Tequila; El Mayor Blanco; Exotico Reposado 100% Agave Tequila; El Mayor Reposado; El Mayor Anejo; HA El Mayor Single Estate 100% Agave Tequila; Hawkeye Blue Raspberry; Pearl Pomegranate; Hawkeye Blue Raspberry Vodka; Pearl Peach; Pearl Cucumber; Pearl Cucumber Vodka; Pearl Vanilla Bean; Pearl Blueberry Vodka; Pearl Citrus Vodka; Pearl Citrus; Pearl Pomegranate Vodka; Pearl Ruby Grapefruit Mini; Pearl Grape Vodka; Pearl Orange; Pearl Grape; Pearl Red Berry Vodka; Pearl Cherry Vodka; Pearl Orange Vodka; Pearl Lemon; Pearl Cherry; Pearl Ruby Grapefruit; Bourbon Supreme Bourbon; Rebel Yell KSBW; Yellowstone Select; Ezra Brooks Ky Sour Mash Bourbon; Ezra Brooks 99pr Bourbon; Rebel Yell KSBW 100prf; Ezra Brooks 50 Mo Ky Sour Mash Bourbon; Ezra Brooks Sour Mash Bourbon; Rebel Yell Straight Kentucky Bourbon; Rebel KSBW 100prf; Rebel KSBW; Daviess County KSBW Cab Finished; David Nicholson 1843 Bourbon; Ezra Brooks Sour Mash Bourbon PET; Ezra Brooks Traveler; Rebel Yell American Whiskey; Brown Sugar Bourbon; Brown Sugar Bourbon 103; Daviess County KSBW French Oak Finished; HA Rebel Yell 10YR Single Barrel; Daviess County Kentucky Straight Bourbon Whiskey; Rebel Yell Kentucky Straight Bourbon Mini; HA Yellowstone Limited Edition 2017; Blood Oath Pact No. 3; David Nicholson 1843; HA Old Ezra 7YR 101prf; David Nicholson Reserve; Paramount Creme de Menthe Green; Arrow Creme de Almond; Arrow Creme de Menthe Green; Paramount Creme de Cacao White; Arrow Creme De Menthe Green; Paramount Creme de Cacao Dark; Arrow Creme de Cacao White; Arrow Creme De Menthe White; Paramount Creme De Cacao/white; Arrow Sloe Gin; Arrow Creme de Menthe White; Stock Limonce; Ezra Brooks Bourbon Cream Mini; St Brendans Irish Cream w/3-50mls; St Brendans w/3-50mls; Ezra Brooks w/Old Fashion Drink Kit; Old Ezra 7YR; Yellowstone Limited Edition 2019; Ezra Brooks w/Flask; El Mayor Cristalino; Yellowstone Limited Edition 2020; Ezra Brooks w/ Glass and Ice Ball Mold; Ezra Brooks Bourbon Cream w/Tumbler; Blood Oath Pact No. 6; Rebel Yell 10yr Single Barrel; Blood Oath Pact No. 7; Arrow Super Cinnamon Schnapps Mini; Blood Oath Pact No. 4; Yellowstone Limited Edition 2018; Blood Oath Pact No.5; Everclear Alcohol 190 Proof; Salvadors Premium Margarita; Piping Rock Peppermint Schnapps; Canadian Springs Whisky; Arrow Ginger Brandy; Salvador''s Mojito Cocktail; Lord Calvert Canadian Whiskey; Lord Calvert Hunting Dog Decanter; El Mayor Reposado Barrel Program; Veev Acai; Ezra Brooks Bourbon Mini; Yellowstone Select Barrel Program; Paramount Butterscotch DISCO; Ezra Brooks Sour Mash Bourbon w/Flask; Arrow Creme De Cacao Brown; Arrow Blackraspberry Liqueur; Yellowstone Hand Picked 109pr Buy the Barrel; Rebel Distillers Collection Buy the Barrel; Rebel Yell KSBW Mini; HA Blood Oath Trilogy 3 Pack; Lady Bligh Spiced Rum Mini; Hawkeye Bacon Vodka DISCO; Cachaca 61; Pearl Coconut Vodka; Paramount Melon Liqueur; Ezra Brooks Distillers Collection Buy the Barrel; George Remus Straight Bourbon; Paramount Anisette DISCO; Rebel Yell Straight Rye Whiskey; El Mayor Anejo Barrel Program; El Mayor Extra Anejo 100% Agave; St. Brendan's Salted Caramel Irish Cream; Ezra Brooks Sour Mash Bourbon Mini; Arrow Blackberry Flav Brandy Pet; Rebel Straight Rye Whiskey; Yellowstone Hand Picked 115pr Buy the Barrel; Pearl Blueberry Mini; Arrow Kirsch Cherry Liqueur; Rossville Union Master Crafted Rye Whiskey; Colonial Club Apricot & Brandy; Pearl Peach Mini; Arrow Triple Sec; St Brendans Irish Cream Mini; Limited Edition Rebel Yell Straight Kentucky Bourbon
LUXCO-CLEVELAND,Karimba Coffee Liqueur; Paramount Sour Apple Schnapps; Paramount Rock & Rye; Paramount Vodka; Paramount Creme De Almond; El Dorado Special Reserve Rum; Paramount Triple Sec; Lady Bligh Cherry Rum; Lady Bligh Mango Rum; Paramount Dragon Fruit Vodka; Paramount Ultra Bubble Vodka; Paramount Whipt Creme Vodka; Mac Alister Scotch; Paramount Long Island Iced Tea; Grand Muriel Orange Liqueur; Davinia Hazelnut Liqueur; Paramount Cherry Brandy; Lady Bligh Spiced Rum; Tatler Scotch Liqueur; Colonial Club Blackberry & Brandy; Macalister Scotch; Paramount Creme De Cacao White
LUXCO-ST LOUIS,Paramount Blackberry Brandy; Everclear Alcohol; Juarez Gold Dss; Juarez Triple Sec; Paramount Cherry Flavored Brandy; Paramount Apricot Flavored Brandy; Paramount Triple Sec; Arrow Blackberry Flav Brandy; Arrow Peach Schnapps; Paramount Amaretto; La Prima Triple Sec; Paramount Cherry Brandy; Paramount Sloe Gin; El Mayor 50ml Trial Pack; Hawkeye Vodka 80 Prf Mini; Paramount Creme De Menthe/green; Paramount Peach Schnapps; Arrow Spearmint Schnapps; Paramount Strawberry Schnapps; Arrow Raspberry Schnapps; Arrow Apricot Flav Brandy; Paramount Creme De Cacao/white; Arrow Creme de Cacao Brown; Paramount Peppermint Schnapps; Pearl Red Berry; Exotico Reposado; Arrow Creme De Menthe Green; Exotico Blanco; Hawkeye Vodka; Paramount Creme De Cacao/dark; Paramount Peach Flavored Brandy; Arrow Mcdale's Butterscotch Schnapps; Paramount Creme De Menthe/white; Arrow Apricot Brandy; Arrow Wild Cherry Flav Brandy; Paramount Anisette; Caffe Lolita Coffee Liqueur; Arrow Sloe Gin; Arrow Creme de Almond; Paramount Butterscotch Schnapps; Arrow Creme de Cacao White; Rebel Yell Small Batch Rye; The Quiet Man; Arrow Anisette; Arrow Ginger Flav Brandy; Everclear 190prf; Arrow Blackberry Flav Brandy Pet; The Quiet Man 8YR; Everclear Lightnin; El Mayor Extra Anejo; Everclear 151; Everclear Alcohol 190 Proof; Ezra Brooks Single Barrel; Arrow Triple Sec; Juarez Tequila Gold; La Prima Tequila/gold; Juarez Tequila Silver; La Prima Tequila/white; El Mayor Blanco; Juarez Gold; El Mayor Anejo Tequila; El Mayor Reposado; Lady Bligh Spiced Rum; Lady Bligh; Lady Bligh Coconut Rum; Lady Bligh Butter Rum; St. Brendan's Superior Irish Cream Liqueur; St. Brendan's Salted Caramel Liqueur; Arrow Creme De Cassis; St Brendan's Irish Cream; Arrow Creme De Strawberry; St. Brendan's Peppermint Bark Liqueur; Pearl Vodka; Pearl Vodka PET; Pearl; Pearl Plum Vodka; Pearl Citrus Vodka; Pearl Orange Vodka; Pearl Black Vodka Mini; Korski Vodka; Paramount Vodka; Wolfschmidt; Hawkeye Blue Raspberry Vodka; Hawkeye Bacon Vodka; Pearl Cucumber Mini; Hawkeye Cherry; Hawkeye Grape; Pearl Vanilla Bean Mini; Pearl Strawberry Basil Mini; Rebel Yell Root Beer Whiskey; Rebel Yell Ginger Whiskey; Rebel Yell Ginger Whiskey Mini; Rebel Yell Root Beer Whiskey Mini; Hawkeye Blend Whiskey; Calvert Extra Bl Whiskey; Rebel Yell American Whiskey; Paramount Gin; Hawkeye Gin; Calvert Gin; Arrow Gin; Paramount Gin Traveler; Canadian Reserve Whisky; Canadian Springs Whisky; Lord Calvert Canadian Whisky; Lord Calvert Canadian Signature; Lord Calvert Canadian Whiskey (Signature); Canadian Regency Light; Pearl Gin; Salvador's Margarita Pet; Paramount Long Island Iced Tea; Purple Passion 4 Pack; Salvador's Margarita 4pak; Salvador's Original Margarita PET; Salvador's Strawberry Margarita 200ml-4Pack; Purple Passion; Salvador's Paloma; Rebel Yell Bourbon; Arrow Peppermint Schnapps; Arrow Peppermint Schnapps Mini; Paramount Peppermint Schnapps Traveler; Thunder 101 Peppermint Schnapps; Paramount Melon Liqueur; Paramount Blue Curacao; Arrow Creme De Menthe White; Paramount Creme de Menthe White; Piping Rock Peppermint Schnapps; Pearl Pomegranate Vodka; Pearl Caramel Vodka; Pearl Cucumber Vodka; Pearl Mini Party Pack; Pearl Red Berry Vodka; Pearl Wedding Cake Vodka; Pearl Blueberry Vodka; Pearl Strawberry Basil; Pearl Peach; Pearl Apple Pie; Pearl Grape; Pearl Vanilla Bean; Pearl Cherry; Pearl Plum; Pearl Citrus; Pearl Coconut Vodka; Pearl Chocolate Covered Cherry; Pearl Whipt Vodka; Pearl Lime Basil; Pearl Pumpkin Spice; Pearl Wedding Cake Vodka Mini; Pearl Chocolate Covered Cherry Mini; Pearl Apple Pie Mini; Stock 84 Brandy; Bourbon Supreme Bourbon; Ezra Brooks Ky Sour Mash Bourbon; Rebel Yell Straight Kentucky Bourbon; Rebel Yell; Ezra Brooks 50 Mo Ky Sour Mash Bourbon; David Nicholson Reserve HA; Old Ezra 7YR; Ezra Brooks Cinnamon; Rebel Reserve Honey; Blood Oath HA; Rebel Yell Small Batch Reserve; Rebel Reserve Cherry; Yellowstone Select; Blood Oath Pact No. 2; Rebel Yell Kentucky Straight Bourbon Mini; Paramount White Rum; Hawkeye Light Rum; Paramount Gold Rum Traveler; Paramount Gold Rum; Paramount White Rum Traveler; Arrow Black Raspberry Liqueur; Black Duck Cranberry Liqueur; Cachaca 61; Pearl Wedding Pack; El Dorado Special Reserve Rum; El Mayor Extra Anejo 100% Agave HA; Salvador's Top Shelf; Salvador's Premium Margarita; Pearl Wedding Cake Vodk; Pearl Chocolate Hazelnut; Paramount Rock & Rye; Arrow Creme De Almond; Arrow Original Blackberry Brandy; Paramount Vodka 100 Proof; Arrow Amaretto; Old Ezra 7yr Str Bourbon; Rebel Yell Cherry Bourbon; Colonial Club Black Raspberry Liqueur; Pearl Caramel; Juarez Gold Tequila; Calvert Extra Blended Whiskey; Salvador's Strawberry Margarita; Arrow Creme De Cacao Brown; Yellowstone Bourbon; Veev Acai; Getreide Kummel; St. Brendan's Irish Cream Liqueur; Arrow Blackraspberry Liqueur; Stock Limonce; Lord Calvert Canadian Whiskey; Davinia Hazelnut Liqueur; Paramount Ginger Brandy; Paramount Sweet Tea Vodka; Old Ezra 7yr 101 proof; Lady Bligh Cherry Rum; Moonpie Moonshine Vanilla; Limited Edition Rebel Yell Straight Kentucky Bourbon; Colonial Club Blackberry & Brandy; Dos Tiranos Mezcal; Salvador's Original Margarita; Paramount Dragon Fruit; Rebel Yell Small Batch Reserve Mini
LUXE VINTAGES LLC,Seven Fathoms Rum
"M.S. WALKER, INC.",Orloff Light Vodka; Mc Gregor's Scotch; Grand Macnish; Allen's Coffee Brandy
MACCHU PISCO LLC,Macchu Pisco; La Diablada Pisco
MACH FLYNT INC.,Kirkland Signature London Dry Gin; Kirkland Signature Tennessee Bourbon 7YR; Kirkland Signature Tennessee Sour Mash Whiskey
MADIKWE USA INC,maDIKwe
"MADIKWE USA, INC.",maDIKwe
MANGO BOTTLING,Tooters Ala Bama Slama; Tooters Red Hot Ink; Tooters Apple-Tini Mini; Tooters Blu-Dacious Kamikazi Mini; Tooters Mellon Ball; Tooters Bahama Mama; Tooters On The Beach; Tooters Melon Ball; Bamama Hama; Tooters Mango Smash
"MANGO BOTTLING, INC.","Tooters Ala Bama Slama; Tooters Blu-Dacious Kamikazi Mini; Tooters Apple-Tini Mini; Tooters Red Hot Ink; Tooters Rainbow 12 Pack; Tooters Whip'd It; Tooters 50ml Marg, OTB, Mango; Tooters 50ml Ala, Tini, Kazi; Tooters Red Diculous On The Beach; Tooters Melon Ball; Tooters Margarita; Tooters Red-Diculous On The Beach; Tooters Triple Berry Punch; Tooter's Triple Berry Punch; Tooters Mango Smash; Tooters Bahama Mama; Tooters Mango Smash Mini"
MARA IMPORTS,Amor Mio Blanco; Amor Mio Extra Anejo; Hoyo 19 Extra Anejo
MARSALLE COMPANY,Outerspace; Leadslingers Napalm; Leadslingers Fighting Spirit Rye; Leadslingers Black Flag Spiced Rum; Outerspace Vodka; Outerspace Mini; Outerspace Vodka Mini; Hacienda Vieja Reposado Tequila; Hacienda Vieja Anejo; Hacienda Vieja Blanco Tequila; Leadslingers Bourbon; Schwartzhog Krauter Liqueur Mini; Schwartzhog Krauter Liqueur; Schwartzhog Liqueur Hogs Head Decanter; Zing 72 Gin w/Copper Cup; Outerspace Chrome w/2 Shot Glasses; Hacienda Vieja Reposado; Schwartzhog w/Ginger Hog Glass; James Oliver Rye
MARSALLE COMPANY/STOLLER WAREHOUSE,Hacienda Vieja; Snow Queen Vodka; Hacienda Vieja Reposado
MASON DIXON SPIRITS LLC,Lemon Ginger 5 Infused Vodka
"MAST-JAEGERMEISTER US, INC",Jagermeister Liqueur; Jagermeister Green Glass Shot Set; Jagermeister Liqueur Mini; Jagermeister w/Smartphone Lens Kit
"MAST-JAGERMEISTER US, INC",Jagermeister Liqueur Mini Meisters; Jagermeister w/ Mobile Phone Wood Amplifier; Jagermeister w/2 Shot Glasses; Teremana Blanco Tequila; Teremana Reposado Tequila; Jagermeister Liqueur Mini; Jagermeister Liqueur; Jagermeister Mini Meisters; Jagermeister Cold Brew Coffee Liqueur Mini; Jagermeister Coolpack; Jagermeister Cold Brew Coffee Liqueur; Jagermeister Green Glass Shot Set; Jagermeister Sustainable Mug VAP; Jagermeister Fever Tree Berlin Mule VAP; Jagermeister w/Smartphone Lens Kit; Jagermeister w/Shot Glass Ice Mold; Jagermeister Charakter Scharf; Jagermeister Manifest Liqueur
MAVERICK SPIRIT LLC,Merrylegs Genever Style Gin
MCCORMICK DISTILLING CO.,"Mccormick Vodka; Mccormick Vodka Pet; McCormick Vodka; 360 Mandarin Orange; 360 Sorrento Lemon; SOOH 360 Bing Cherry; Whicked Pickle Flavored Whiskey; SOOH 360 Sorrento Lemon; 360 Red Raspberry; Tarantula Azul; Tequila Rose Holiday w/1 Collins Glass; 360 Madagascar Vanilla Vodka; 360 Sorrento Lemon Flavored Vodka; Broker's Gin Holiday w/1 Collins Glass; Tarantula Ready To Drink Blue Margarita; 360 Vodka; McCormick Egg Nog w/2 Glasses; Hussong's Combo Pack; 360 Madagascar Vanilla; 360 Sorrento Lemon Vodka; McCormick Vodka Mini; 360 Glazed Donut Flavored Vodka; Tequila Rose Liqueur Mini; Tequila Rose Liqueur; Five Farms Irish Cream Liqueur; McCormick's Irish Cream; McCormick Irish Cream; KeKe Key Lime Liqueur; McCormick 80prf Vodka PET; McCormick 80prf Vodka; McCormick 80prf Vodka Mini; Dueces Wild Vodka; Mccormick Blend Whiskey; Mccormick Blend Whiskey, Pet; Mccormick Blend Whiskey PET; McCormick Gin PET; McCormick Gin; McCormick Gin Pet; Canadian Woods Canadian Why; Canadian Woods Canadian Whisky; Broker's London Dry Gin; Brokers Gin; Hussong's Platinum Anejo; Hussongs Platinum Anejo; Hussong's Reposado Tequila 100% Agave; McCormick Apple Vodka; McCormick Peach Vodka; 360 Double Chocolate Vodka; 360 Georgia Peach; 360 Double Chocolate; 360 Georgia Peach Vodka; 360 Huckleberry Vodka; 360 Huckleberry; 360 Lime; 360 Lime Vodka; 360 Huckleberry Mini; 360 Vodka Patriot; 360 Lime Vodka Mini; Tequila Rose w/2 Shot Glasses; 360 Vodka Patriot 1.75L w/360 Mango 50ml; 360 Bing Cherry Mini; 360 Sorrento Lemon Vodka Mini; McCormick Irish Cream w/2 Glasses; Tarantula Lime Margarita; Tarantula Strawberry Margarita; 360 Lime Mini; 360 Sorrento Lemon Mini; Brokers Gin w/Stemless Martini Glass; 360 Mandarin Orange Vodka; 360 Red Raspberry Flavored Vodka; 360 Bing Cherry; 360 Concord Grape; Platte Valley Fireshine; 360 Red Delicious Apple Vodka; Mccormick Rum Silver; Hussongs Reposado; 360 Red Delicious Apple; Tequila Rose Pet; Triple Crown Blended Whiskey; Platte Valley Corn Jugs; Brokers Gin Mini; 360 Royal Berry; 360 Glazed Donut; Montego Bay Coconut Rum; 360 Watermelon Vodka; 360 Mango; McCormick Gold Label MO Bourbon; Platte Valley Moonshine Corn Jugs; Tarantula Blue Ready To Drink Margarita; 360 Grape Vodka; Tequila Rose; McCormick Gold Label Bourbon; 360 Grape; 360 Huckleberry Flavored Vodka; Hussong''s Combo Pack; Hussong's 100% Silver Tequila; 360 Watermelon Flavored Vodka"
MCCORMICK DISTILLING COMPANY,"McCormick Vodka; Mccormick Vodka Pet; Mccormick Vodka; Tequila Rose w/2 Shot Glasses; Tarantula Azul Liqueur; Dueces Wild Vodka; McCormick Egg Nog w/2 Glasses HA; Tarantula Azul Co Pack; McCormick Egg Nog w/2 Glasses; Tequila Rose Valentine w/2 Shot Glasses; McCormick Irish Cream w/2 Glasses; Tequila Rose w/2 Shot Glasses HA; Tequila Rose Valentine 2013 Gift Set; Tarantula Reposado; Tarantula Plata 100; Hussong's Reposado Tequila; Hussong's Platinum Anejo; Hook's Spiced Rum; Hook's Spiced Rum Pouch Mini; Montego Bay Coconut Rum; Tequila Rose Liqueur; Tequila Rose Liqueur Mini; McCormick's Irish Cream; Hot Rose Cinnamon Cream Liqueur; Tequila Rose Pet; Hot Rose Cinnamon Cream Liqueur Mini; Mccormick Vodka PET; McCormick Vodka Mini; 360 Vodka; 360 Red Raspberry; 360 Georgia Peach Vodka; 360 Glazed Donut; 360 Double Chocolate Vodka; 360 Glazed Donut Flavored Vodka; 360 Madagascar Vanilla Vodka; 360 Mandarin Orange Vodka; 360 Concord Grape Vodka; 360 Sorrento Lemon Vodka; 360 Huckleberry Vodka; 360 Buttered Popcorn; 360 Georgia Peach; 360 Double Chocolate w/Gravity Unit; 360 Sorrento Lemon Vodka Mini; 360 Mandarin Orange Vodka Mini; 360 Georgia Peach Vodka Mini; 360 Huckleberry Mini; 360 Glazed Donut Mini; 360 Red Raspberry Mini; 360 Bing Cherry; 360 Buttered Popcorn Mini; Triple Crown Blended Whiskey; Mccormick Blend Whiskey, Pet; Mccormick Blend Whiskey; Triple Crown Blended Whiskey Pouch Mini; McCormick Gin; McCormick Gin Pet; Canadian Woods Canadian Why; Broker's London Dry Gin; Platte Valley Moonshine Corn Jugs; Mccormick Rum Silver; Ke Ke Beach Plastic; McCormick Irish Cream w/2 Glasses HA; Hussong's Reposado Tequila 100% Agave; 360 Red Raspberry Flavored Vodka; McCormick Peach Flavored Vodka; Mccormick Blended Whiskey; 360 Double Chocolate; Tequila Rose Cocoa; 360 Grape Vodka; 360 Sorrento Lemon Flavored Vodka; 360 Concord Grape Vodka Mini; Tarantula Blue Ready To Drink Margarita; 360 Huckleberry Flavored Vodka; Platte Valley Fireshine; 360 Bing Cherry Vodka; 360 Madagascar Vanilla Vodka Mini; Mccormick Raspberry Vodka Handle; McCormick Whipped Cream Flavored Vodka"
MEISENBURG BREWING & DISTILLING,Treboles & Key Organic Vodka; Corazon and Key Organic Vodka
