vendor_name,item_names
DOMAINE CHARBAY,Tequila Tapatio Blanco; Charbay R5 Whiskey; Tequila Tapation Reposado; Charbay Clear Vodka; Charbay Blood Orange Vodka
DOMAINE SELECT,Paul John Peated; Atlantico Reserva; Atlantico Platino; Paul John Brilliance; Atlantico Gran Reserva; Paul John Classic; Paul John Edited
DOMAINE SELECT WINE ESTATES,Suze D'Autrefois
"DORADO, PIZZORNI & SONS, LLC",Frida Kahlo Blanco Tequila; Frida Kahlo Reposado Tequila; Frida Kahlo Anejo Tequila
DREYFUS ASHBY,Massenez Pear In Bottle Poire Williams; Massenez Poire William Poire Prisonniere
"DREYFUS, ASHBY CO.",Massenez Poire William Pear Brandy; Massenez Pear In Bottle Poire Williams
DRIFTLESS GLEN DISTILLERY,Premium Vodka; Driftless Glen Bourbon; Driftless Glen Rye Whiskey; Driftless Glen 5YR Reserve Brandy; Cucumber Vodka; Lemon Vodka; Driftless Glen Handpicked Single Barrel Cask Strength; Driftless Glen Cask Strength Single Barrel Rye Buy the Barre; Driftless Glen RYE Whiskey; Driftless Glen Single Barrel Straight Bourbon Buy the Barrel; Driftless Glen 51 RYE; Driftless Glen Reserve Brandy; Driftless Glen Single Barrel Straight Bourbon; Driftless Glen Single Barrel Straight Rye Whiskey
DRINK DOGG ALCOHOL IMPORTS,Blavod Black Vodka
DRINKS AMERICAS,Kah Anejo Mini; Kah Reposado Mini; Kah Blanco Mini; Kah Extra Anejo
"DRUM CIRCLE DISTILLING, LLC",SIESTA KEY SPICED RUM; Siesta Key Toasted Coconut Rum; Siesta Key Distillers Reserve Spiced; SIESTA KEY TOASTED COCONUT RUM; Siesta Key Spiced Rum
DRY FLY DISTILLING,Dry Fly Wheat Whiskey; Dry Fly Vodka; Dry Fly Gin
DUGGAN'S DISTILLERS PRODUCTS CORP,Forbidden Secret Pumpkin Spice Liqueur; Forbidden Secret Coffee Pack; Forbidden Secret Dark Mocha; Forbidden Secret White Chocolate; Medea; Medea Vodka; Breakout Rye Whiskey; Jailers Tennessee Whiskey; Asbach Uralt Brandy; Forbidden Secret White Chocolate Liqueur; Asbach 8yr Privatbrand; Vizcaya Rum
DUGGANS DISTILLERS,Asbach Uralt Brandy; Asbach 8yr Privatbrand; Forbidden Secret White Chocolate; Finlaggan Old Reserve; Medea; Duggans Dew Blended Scotch Whisky 86.8; Asbach Uralt Brandy 3YR; Forbidden Secret Dark Mocha; Forbidden Secret White Chocolate Mini; Forbidden Secret Mocha Mini; Forbidden Secret Pumpkin Spice Liqueur; Forbidden Secret Coffee Pack; Bobbys Scheidam Gin; Bobbys Schiedam Jenever
DUNKEL CORPORATION,Saints N Sinners Apple Pie; Caribbean Cask Rye Whiskey; Rocket Fuel; Steel Drum; Swell Zone Vodka; Prairie Fire; Prairie Fire Mini; Iowa Distilling Company Straight Bourbon Whiskey; Country Gal; Iowa Distilling Company Double Oak Rye
DUNKEL CORPORATION / IOWA DISTILLING,Saints ''n Sinners Mini; Saints N Sinners Apple Pie; Rocket Fuel; Saints N Sinners Mini; Steel Drum; Swell Zone Vodka; Prairie Fire; Prairie Fire Mini; Country Gal; Iowa Distilling Company Straight Bourbon Whiskey; Iowa Distilling Company Double Oak Rye
DURHAM DISTILLERY,Conniption American Dry Gin; Conniption Navy Strength Gin
DV SPIRITS LLC,American Born Moonshine Original; American Born Moonshine Apple Pie; Dulce Vida Grapefruit; Dulce Vida Blanco; Dulce Vida Pineapple Jalapeno; Dulce Vida Lime; SOOH Dulce Vida Blanco 100prf; Dulce Vida Tequila Lime; American Born Peach Whiskey; American Born Apple Whiskey; American Born Bourbon Whiskey; SOOH American Born Original Moonshine; SOOH Dulce Vida Organic Blanco Tequila; Dulce Vida Tequila Pineapple Jalapeno; American Born Original Moonshine
E & J GALLO WINERY,New Amsterdam Vodka; John Barr Reserve; RumHaven; E & J Peach; Viniq DISCO; New Amsterdam Peach Mini; Isle of Jura 10YR; Viniq; Diplomatico Reserva Exclusiva; Diplomatico Ambassador; Dalmore 12YR; Dalmore Port Wood Reserve; New Amsterdam 100prf; Diplomatico Mantuano; Viniq Ruby DISCO; New Amsterdam Vodka Mini; Diplomatico Single Vintage; SOOH Amaro Montenegro; Dalmore 15YR; SOOH Diplomatico Reserva Exclusiva; Amaro Montenegro; Dalmore Cigar Malt Scotch; RumHaven Mini; Diplomatico Planas; RumChata Limon; Familia Camarena Silver; Familia Camarena Reposado; RumChata Mocha Cold Brew; RumChata Mini; RumChata Cold Brew; RumChata; RumChata GoChatas; RumChata MiniChatas Creamer Cups; Tippy Cow Vanilla Soft Serve; Tippy Cow Shamrock Mint; Tippy Cow Chocolate; Tippy Cow Orange Cream; Shackleton; New Amsterdam 80prf Mini; New Amsterdam 80prf; New Amsterdam; New Amsterdam Gluten Free Mini; New Amsterdam Gluten Free; The Dalmore Port Wood Reserve; E & J VS Round; E & J VS; E & J VSOP; E & J Vs Brandy; E & J Vsop Superior Reserve; E & J VS Square; E & J VS Mini; E & J Vsop Superior Reserve Mini; E & J Apple Mini; E & J Apple; E & J XO; E & J VSOP Mini; E & J Vs Brandy Square; E & J Vs; E & J Vs Brandy Round; E & J Vs Brandy Mini; E & J VS PET; E & J Apple Brandy; E & J XO Brandy; E & J Vs Brandy Travelers; E & J Apple Brandy Mini; E & J Vanilla; E & J Peach Brandy; New Amsterdam Gin; New Amsterdam Stratusphere London Dry Gin; New Amsterdam Orange; New Amsterdam Apple Vodka; New Amsterdam Red Berry; New Amsterdam Raspberry; New Amsterdam Pineapple; New Amsterdam Mango; New Amsterdam Peach; New Amsterdam Pink Whitney Mini; New Amsterdam Pineapple Mini; New Amsterdam Apple; New Amsterdam Pink Whitney; New Amsterdam Lemon; New Amsterdam Orange Mini; New Amsterdam Watermelon; New Amsterdam Grapefruit Mini; New Amsterdam Coconut; New Amsterdam Grapefruit; SOOH New Amsterdam Mango Mini; New Amsterdam Red Berry Mini; New Amsterdam Citron DISCO; New Amsterdam Mango Mini; Tippy Cow 50ml Sampler; E & J Spiced; The Dalmore 12 Year w/Glasses; The Dalmore Port Wood Reserve w/ Glasses; RumHaven VAP; E & J Vsop; Dalmore 15yr Single Malt; Viniq Ruby; New Amsterdam Citron; Diplomatico Reserva Exclusiva w/Glasses; Isle Of Jura 10 Yr; The Dalmore Cigar Malt Scotch; Dalmore 1263 King Alexander; Dalmore 18YR; New Amsterdam Apple Mini; New Amsterdam Pineapple Vodka; New Amsterdam Citron Vodka
E AND J GALLO WINERY,E & J Peach; E & J Peach Brandy; Shellback Silver; E & J Apple; New Amsterdam 100prf; Dalmore 12YR; Dalmore 15yr Single Malt; The Dalmore 12 Yr Single Malt Scotch; E & J Apple Brandy; Familia Camarena Reposado; Familia Camarena Silver; Shellback Spiced; Shellback Spiced Mini; E & J Cask & Cream; E & J Chocolate Temptation; New Amsterdam Vodka Mini; New Amsterdam Vodka; New Amsterdam; Shaker's Rye Vodka; Shaker's Original American Vodka; New Amsterdam Peach; New Amsterdam Pineapple; New Amsterdam Red Berry; New Amsterdam Citron; New Amsterdam Mango; New Amsterdam Orange; New Amsterdam Coconut Mini; New Amsterdam Red Berry Mini; New Amsterdam Peach Mini; New Amsterdam Coconut; New Amsterdam Citron Mini; New Amsterdam Gin; New Amsterdam Gin Mini; Viniq; E & J Vs Brandy; E & J Vsop Superior Reserve; E & J Vs; E & J Vs Brandy Round; E & J VS; E & J Vsop Superior Reserve Mini; E & J Vs Brandy Square; E & J Vs Brandy Mini; E & J Vs Brandy Travelers; E & J Xo Brandy; E & J XO; E & J Vs Grand Amber Brandy; E & J Vsop; Viniq Ruby; Shellback Silver Mini; New Amsterdam Peach Vodka; New Amsterdam Coconut Flavored; New Amsterdam Red Berry Vodka; E & J Gallo Vsop Superior Reserve; Cask & Cream Chocolate Temptation DNO; Isle Of Jura 10 Yr; The Dalmore 1263 King Alexander; New Amsterdam Citron Flavored; The Dalmore Cigar Malt Scotch; New Amsterdam Mini
EASTSIDE DISTILLING,Cherry Bomb Whiskey; Portland Potato Vodka; Barrel Hitch American Whiskey; Barrel Hitch Oregon Oak American Whiskey; Burnside Bourbon; Burnside Oregon Oaked Bourbon
EDRINGTON GROUP USA LLC,SOOH Famous Grouse Scotch; Macallan 12YR; The Macallan Double Cask 12YR; Macallan 12 Yr Single Malt Scotch; Brugal Anejo Rum; Macallan Double Cask 12YR; Macallan 18yr Single Malt Scotch; Macallan Fine Oak 10 Year; HA The Macallan Classic Cut; Macallan Fine Oak 15yr; Highland Park 12yr Single Malt Scotch; Highland Park Dark Origins DISCO; Highland Park 12YR Viking Honour; Highland Park Magnus; The Macallan Sherry Oak 12YR; Macallan Double Cask Gold; Macallan 18YR; Macallan 18YR Single Malt; HA Highland Park 15YR DISCO; HA The Macallan Edition No. 3 DISCO; Highland Park 18YR; Brugal 1888 Gran Reserva; Brugal Extra Veijo Rum; Brugal Anejo Superior Rum; Brugal XV Rum; Macallan Triple Cask Matured 12 year; Brugal Especial Extra Dry; Famous Grouse Scotch; Cutty Sark Scotch; HA Macallan Rare Cask; HA Macallan Edition No. 2 DISCO; The Famous Grouse Smoky Black; Naked Grouse Blended Malt Scotch Whisky; Partida Blanco Tequila; Wyoming Whiskey Small Batch Bourbon; Noble Oak Double Oak Bourbon; Macallan Triple Cask Matured 12YR; Macallan Edition No. 3; Macallan Rare Cask; HA Highland Park Fire Edition; HA Highland Park Ice Edition DISCO; Macallan Rare Cask Single Malt Scotch Whisky; Wyoming Whiskey Double Cask Bourbon; Highland Park The Light; Highland Park The Dark; Cutty Sark; HA Highland Park Valkyrie; The Macallan Gold; Macallan 12yr Scotch Mini; The Glenrothes Peated Cask Reserve; Noble Oak Rye; Glenrothes 12YR; Glenrothes 1998 DISCO; Famous Grouse Smoky Black; Highland Park Dark Origins; Partida Anejo Tequila; Partida Reposado Tequila; Partida Elegante Tequila; The Glenrothes Vintage Reserve; Highland Park Twisted Tattoo; Glenrothes 18YR; Wyoming Whiskey Outryder Straight American Whiskey
"EVATON, INC.",Busnel Calvados Fine; Arak Razzouk; Ramazzotti Amaro; Busnel Calvados Pays D'auge Vsop
FAMOUS BRANDS,Merica Small Batch Bourbon
FETZER VINEYARDS,SOOH Kentucky Peerless Straight Rye Whiskey - Small Batch; Peerless Straight Rye Whiskey Barrel Proof; Kentucky Peerless Straight Rye Whiskey - Small Batch
FIFTH GENERATION INC,Titos Handmade Vodka; Titos Handmade Mini; Titos Vodka; Titos Handmade Vodka Mini
FIFTH GENERATION INC.,Titos Handmade Vodka; Titos Vodka; Titos Handmade Mini
FILIBUSTER BARRELS LLC,Filibuster Single Estate; Filibuster Straight Bourbon
FIRE TAIL BRANDS LLC,Jekyll Berry Liqueur; Hyde Herbal Liqueur
FIRESTARTER SPIRITS INC.,Firestarter Vodka
"FIRESTONE & ROBERTSON DISTILLING COMPANY, LLC",TX Blended Whiskey; TX Bourbon
FLEMISH LION LLC,Diep9 Young Genever
"FOUNDRY DISTILLING COMPANY, LLC",Foundry Corn Whiskey; Midnight Ritual; The Real Stuff; Foundry Whiskey Custom; Foundry Rum; Foundry Vodka; Butcher's Block Vodka; Okoboji Vodka; Butchers Block Vodka; Foundry Five Grain Whiskey; Foundry Bourbon; Foundry Gin; Foundry Single Malt Whiskey; Arrogant Bastard Whiskey; Jethro's Vodka; Lake Ponderosa Vodka - Buy the barrel; Exile Single Malt American Whiskey; Foundry Vodka Custom; Blonde Fatale Whiskey; 1900 Whiskey; Jethros Vodka; Okoboji Vodka Mini; Peak Vodka; Crow Valley Golf Club Buy the Barrel; Glen Oaks Whiskey Buy the Barrel
FOUR ROSES DISTILLERY,Four Roses Single Barrel; Four Roses Yellow; Four Roses Yellow Label; Four Roses Small Batch; Four Roses 2014 Limited Edition Small Batch HA; Four Roses Bourbon; Four Roses Small Batch Select; HA Four Roses Small Batch 2020 Limited Edition; HA Four Roses 130th Anniversary LE Small Batch 2018; HA Four Roses Small Batch 2019 LE; HA Four Roses 2017 Small Batch Limited Edition DISCO; Four Roses Single Barrel - Private Selection-Barrel Strength; Four Roses SB Limited Edition 2013; Four Roses 2015 Limited Edition Small Batch; Four Roses Private Selection 100prf Single Barrel; HA Four Roses Al Youngs 50th Anniversary DISCO; Four Roses 2013 Limited Edition Small Batch
FRANK LIN DISTILLERS PRO,Black Saddle Bourbon; Wathen's Single Barrel Bourbon; 8 Seconds Canadian Whiskey; Wathens Single Barrel Bourbon; Buck Bourbon 8YR; Buck Bourbon 8 Year; Bellringer Gin; Old Medley 12YR
FRANK-LIN DISTILLERS PRODUCTS LTD.,8 Seconds Canadian Whiskey; Middle Sister Mojito; Middle Sister Margarita; Middle Sister Cranberry Cosmo; Buck Bourbon 8 Year; Old Medley 12YR; Black Saddle Bourbon
FREDRICK WILDMAN & SON,Chartreuse Yellow; Sheep Dip Orig Oldbury Malt Scotch; SOOH Chartreuse Green French Liqueur; Edinburgh Gin; Pig's Nose Scotch; OP Anderson Aquavit; Edinburgh Gin Rhubarb & Ginger Liqueur
GARGOYLE ENTERPRISES / LAWS WHISKEY HOUSE,Four Grain Straight Bourbon; San Luis Valley Straight Rye Whiskey; Laws San Luis Valley Rye Bottled in Bond; Four Grain Straight Bourbon Bottled in Bond
GEMINI SPIRITS,Pueblo Viejo Anejo Tequila; SOOH Margaritaville Silver Tequila; Margaritaville Island Lime; Margaritaville Spiced Jamaican Rum; Praline Pecan Liqueur; Margaritaville Last Mango; Pueblo Viejo Reposado; Margaritaville Coconut Jamaican Rum; Concannon; Glenfarclas 17yr; Glenfarclas 10yr; Corazon De Agave Anejo Tequila; Glenfarclas 21yr; Penderyn Single Malt Welsh Why.; Glenfarclas 12yr 6pak Sing Malt; Margaritaville Classic Lime Margarita; Margaritaville Last Mango Margarita; Siete Leguas Anejo; Siete Leguas Reposado; Glenfarclas 25yr Sing Malt; Glenfarclas 17YR; Feeney's Irish Cream; Margaritaville Island Lime Tequila; Margaritaville Gold Tequila; Margaritaville Silver Tequila; Corazon Tequila Blanco; Corazon de Agave Tequila Blanco; Corazon De Agave Reposado Tequila; Pueblo Viejo Blanco; Del Maguey Vida Mezcal; Corazon Blanco Tequila; SOOH Cachaca 51; Margaritaville Dark Rum; Margaritaville Coconut Rum; Corazon Anejo; Corazon Anejo Tequila; Ryan's Cream Liqueur; Baja Luna Black Raspberry; Mc Guires Original Cream Liqueur; Margaritaville Skinny Margarita; Margaritaville Skinny Island Punch; Ryans Cream Liqueur; Ryans Cream Liqueur Mini; Glenfarclas 12YR; Glenfarclas 10YR Single Malt; Glenfarclas Single Malt 105; Glenfarclas 10YR; Forty Creek Barrel Select Canadian; Hartley; Corazon de Agave Blanco; Corazon de Agave Reposado; Corazon De Agave Blanco; Margaritaville Silver Tequila Mini; Corazon De Agave Reposado; HA Expresiones Corazon Anejo Thomas Handy; Siete Leguas Blanco; Siete Lequas Blanco Tequila; Hartley Brandy; Grangala Triple Orange Liqueur; Margaritaville Spiced Rum; Cachaca 51; Peter Heering Cherry Liqueur; Pirassunga 51 Cachaca; Gran Gala Liqueur; Limonce Lemon Liqueur; Glenfarclas 105 6pak Sing Malt Scotch; Corazon Blanco; San Matias Gran Reserva Tequila; Baja Rosa Strawberry Liqueur; Ryan's Cream Mini; Del Maguey San Luis Del Rio; Glenfarclas 25YR; Pere Magloire VSOP; Corazon Reposado; Margaritaville Gold Tequila Mini; San Matias Gran Reserva Anejo; Pirassunga 51 Cachaca DNO; Encanto Grand & Noble; Tortuga Banana Rum; Glenfarclas 40YR Scotch; Glenfarclas 105 6pk; Glenfarclas 105 Scotch; Glenfarclas 21YR; Del Maguey Mezcal Vida; Concannon Irish Whiskey; Penderyn Single Malt Welsh Whiskey; Margaritaville Oro; Pueblo Viejo Blanco Tequila; Gran Gala Liqueur Mini; Margaritaville Dark Jamaican Rum; Del Maguey Chichicapa Tequila; Corazon Anejo Buy the Barrel
GEORGETOWN TRADING CO. LLC,James E. Pepper 1776 Straight Rye Whiskey ''100 Proof''; James E. Pepper 1776 Straight Bourbon Whiskey ''100 Proof''; Old Pepper Single Barrel Rye
GEORGETOWN TRADING CO. LLC / JAMES PEPPER DISTILLING CO.,James E. Pepper 1776 Straight Rye Whiskey ''100 Proof''; James E Pepper 1776 Straight Rye Whiskey 100prf; James E Pepper 1776 Straight Bourbon Whiskey 100prf; James E. Pepper 1776 Straight Bourbon Whiskey ''100 Proof''; Old Pepper Single Barrel Rye
GLASS REVOLUTION IMPORTS,Waterford Organic Gaia Irish Single Malt Whisky; Waterford Rathclogh�Single Farm Origin Irish Single Malt; Waterford Dunmore Single Farm Origin Irish Single Malt; Waterford Dunbell Single Farm Origin Irish Single Malt
"GLOBAL BEVERAGE TEAM, LLC",Los Amantes Joven; Los Amantes Mezcal Anejo  Tequila
"GLOBAL SPIRITS USA, LLC",Khortytsa Platinum Vodka
GOAMERICAGO BEVERAGES LLC,WhistlePig 10YR; Whistlepig Single Barrel Buy the Barrel; Whistlepig 12 Year Old World; HA WhistlePig FarmStock Rye Crop 2; WhistlePig Old World 12YR; HA WhistlePig BossHog VI; HA WhistlePig FarmStock 3; Whistlepig 10YR; WhistlePig Straight Rye Whiskey 15 Year; WhistlePig Straight Rye Whiskey 15YR
GOAMERICAGO BEVERAGES LLC / WHISTLEPIG,WhistlePig 6 Year PiggyBack; WhistlePig 10YR Mini; WhistlePig 10YR; HA WhistlePig FarmStock 3; WhistlePig Straight Rye Whiskey 15YR; WhistlePig Old World 12YR; HA WhistlePig The BossHog VII Magellans Atlantic; HA WhistlePig BossHog VI; WhistlePig Rye Piglets Mini; WhistlePig 6YR PiggyBack; WhistlePig HomeStock; WhistlePig 10YR 375; WhistlePig 18YR Double Malt; WhistlePig 18 Year Double Malt; Whistlepig Single Barrel Buy the Barrel; HA WhistlePig Boss Hog V Spirit of Mauve; WhistlePig Straight Rye Whiskey 12 Year- Bespoke Barrel
GRAND PRIX BEVERAGE LLC,Badel Prima Brand; Badel Williams Pear Brandy; Plantaze Montenegro Lozova Rakija; Badel Stara Sljivovica Old Plum Brandy; Takovo Sljivovica Plum Brandy; Takovo Kajsija Apricot Brandy; Takovo Viljamovka Williams Pear Brandy; Takovo Dunja Quince Brandy; Gjergj Kastrioti Skenderbeu V.S.O.P Konjak; Roner Obstler; Roner Kirschwasser; Stara Sokolova Dunja; Badel Svatovski Kruskovac; Badel Lavov; Gjergj Kastrioti Skenderbeu V.S Konjak; Gjergj Kastroti Skenderbeu Balle Kazani Skrapari; Roner Waldhimbeergeist; Stara Sokolova Viljamovka; Stara Sokolova Kajsija; Roner Williams Pear; Stara Sokolova Travka; Stara Sokolova Medovina
GRAND TETON DISTILLERY,Grand Teton Vodka
GRAY DUCK SPIRITS LLC,Gray Duck Vodka
"GREEN FROG DISTILLERY, LLC",Green Frog Distillery Barreled Aged Corn Whiskey; Green Frog Distillery Caramel Flavored Corn Whiskey; Green Frog Distillery Straight Corn Whiskey; Green Frog Distillery Straight Corn Whiskey 100prf; Green Frog Distillery Cranberry Flavored Corn Whiskey; STRAIGHT CORN WHISKEY; Green Frog Distillery Straight Corn Whiskey 80prf DISCO; Green Frog Distillery Straight Corn Whiskey 80prf
GUNSANDMORE INFO LLC,Sipp'n Sweet Corn; Sipp'n -N- Mix'n
GUNSANDMORE.INFO,Sipp'n Sweet Corn
H A P LLC,One Barrel Rum
HAAS BROTHERS,ArteNOM Seleccion de 1579 Blanco; Don Amado Mezcal Rustico; Tequila Cimarron Reposado; Cimarron Tequila Blanco; Tequila Fuenteseca Cosecha Blanco 2018; Artenom 1580 Blanco; Tequila Artenom Seleccion 1146 Anejo
HAWAII SEA SPIRITS LLC,Ocean Organic Vodka; Ocean Organic Vodka Mini
HEADFRAME SPIRITS,Orphan Girl Bourbon Cream Liqueur
