vendor_name,item_names
PERNOD RICARD USA/AUSTIN NICHOLS,"Kahlua Coffee Liqueur; Malibu 50ml Counter Unit; Jameson; The Glenlivet w/50ml 15YR & 18YR; Kahlua w/Absolut 50ml & White Russian Glass; Avion Silver w/Powell & Mahoney Margarita Mix; Absolut Nightlife; Malibu w/50ml Black & Red; Absolut w/ Zing Zang Bloody Mary Mix; Glenlivet 12 Yr Malt Scotch; Malibu w/Dole Pineapple Juice; Kahlua French Vanilla Liqueur; The Glenlivet Tasting Kit w/12YR 200ml, 15YR 200ml & 18YR 200ml; Absolut w/50ml Citron & Mandrin; Powers Irish Whiskey; Absolut w/4-50mls; Absolut w/2 Citron 50ml & 2 Mandrin 50ml; Absolut Warhol; Kahlua Midnight; Hiram Walker Triple Sec; Avion Espresso; Paddy Old Irish Whiskey; Jameson w/Shot Glass; Paddy Bee Sting Mini; Kahlua Especial; Scapa Skiren; Jameson Mini; Glenlivet 15 Year French Oak; Kahlua Peppermint Mocha; Seagrams Lime Twisted Gin; Absolut w/Ginger Beer; Absolut Tune; Jameson Caskmates; Kahlua Gingerbread; Absolut Zing Zang Bloody Mary Mix; Malibu Counter Unit; Jameson w/Fever Tree Ginger Beer; Absolut Unique; Avion Silver w/4 Shot Glasses; Jameson 12YR HA; Kahlua Salted Caramel; Jameson Trilogy Pack; Malibu Peaches N' Cream; Jameson Black Barrel; Kahlua Mocha Liqueur; Absolut Electrik; Seagram's Orange Twisted Gin; Seagram's Pineapple Twisted; Hiram Walker Caramel Apple; Hiram Walker Pumpkin Spice; Jameson Irish Whiskey Tin; Kahlua Pumpkin Spice; Paddy Devil's Apple; Jameson Gold; Midleton Rare HA; Seagrams Peach Twisted Gin; Kahlua Cinnamon Spice; Kahlua Hazelnut; Seagrams Melon Twisted Gin; Absolut Electrik w/2 Glasses; Aberlour 12 Year Single Malt Scotch; Hiram Walker Peppermint Schnapps Sportsman Pack; Kahlua Tin; Hiram Walker Blackberry Brandy; Seagrams Red Berry Twisted Gin; Chivas Regal w/2 Glasses; Glenlivet 18yr; Seagram Lime Twisted Gin; Green Spot HA; Paddy Bee Sting; Aberlour A'bunadh 10yr; Absolut w/Powell & Mahoney Bloody Mary Mix; Absolut with Ginger Beer; Aberlour 16yr Scotch; Hiram Walker Creme De Menthe White; Aberlour A'bunadh 10 Year; Paddy Irish; Hiram Walker Pomegranate Schnapps; Redbreast Irish Whiskey; Redbreast 12YR; Absolut Citron w/Cranberry Juice; Green Spot; Absolut w/Cranberry Juice; Glenlivet 16yr Nadurra; Jameson 18YR HA; Glenlivet Nadurra Oloroso; Redbreast 15yr; Plymouth Sloe Gin; Redbreast 15YR; Absolut Ruby Red w/ Grapefruit Juice; Aberlour A'bunadh; Powers John Lane; Powers Signature; Redbreast Cask Strength HA; Aberlour 18yr; The Glenlivet; Seagram's Lime Twisted Gin; The Glenlivet Sing Malt Scotch; Glenlivet 12YR; Beefeater w/Yeoman Pourer; Kahlua Sampler Pack; Jameson 12yr Irish Whiskey HA; Kahlua Coffee Liqueur Mini; Paddy Devil's Apple Mini; Hiram Walker Peach Schnapps; Hiram Walker Cherry Brandy; Hiram Walker Crm De Menthe Green; Hiram Walker Crm D Cacao White; Hiram Walker Peach Brandy; Hiram Walker Triple Sec 30prf; Hiram Walker Amaretto; Beefeater w/ 4 Coasters; Seagram's Pineapple Twisted Gin; Hiram Walker Coffee Brandy; Redbreast 21yr HA; The Glenlivet Archive 21YR Sing Malt HA; Seagram's Apple Twisted Gin; Chivas Regal 12YR Tin; The Glenlivet 25 year old HA; Redbreast 12yr Cask Strength HA; Olmeca Altos Reposado; Hiram Walker Cherry Brandy 3pak; Hiram Walker Creme De Menthe White 3 Pak; Midleton Barry Crockett Legacy HA; Hiram Walker Sloe Gin 3-Pak; Avion Silver; Olmeca Altos Plata; Avion Reposado; Olmeca Altos Plata Mini; Avion Anejo; Olmeca Plata; Olmeca Reposado; Olmeca Altos Reposado Mini; Tequila Avion Counter Unit; Malibu Island Spiced; Malibu Island Spiced Mini; Malibu Coconut Rum; Malibu Peach Sparkler; Malibu Island Melon; Malibu Black Miniature; Malibu Mango Rum; Malibu Red PET Mini; Malibu Coconut Rum Mini; Malibu Pineapple Rum; Malibu Orange Float Mini; Malibu Passion Fruit Rum; Malibu Red; Malibu Black; Malibu Pineapple Upside Down Cake; Malibu Swirl; Malibu Cranberry Cherry; Malibu Rum Sparkler; Malibu Sunshine; Malibu Orange Float; Malibu Sundae; Malibu Tropical Banana Liqueur; Malibu Counter Unit Beach Party Pack; Malibu Black Mini; Malibu Swirl Mini; Malibu Sunshine PET Mini; Malibu Sundae Mini; Malibu Cranberry Cherry Mini; Absolut Swedish Vodka 80 Prf; Absolut Swedish Vodka 80 Prf Mini; Fris Danish Vodka; Absolut Vodka 100 Premium; Absolut Vodka Glimmer; Chivas Regal 12 Yr; Passport Scotch; Ballantine's Scotch Finest; Chivas Regal 18 Year; Longmorn 16yr Scotch; Chivas Regal 12yr; Ballantines 17YO; Chivas Regal 12yr Scotch Minis; Chivas Royal Salute; Seagrams Extra Dry Gin; Seagrams Extra Dry Gin Mini; Seagrams Extra Dry Gin Pet; Seagram's Distiller's Reserve Gin; Seagram's Pineapple Twisted Mini; Seagram's Peach Twisted Gin Mini; Wiser's Deluxe; Pike Creek Whisky; Wiser's Spiced Vanilla; Pike Creek; Wiser's Rye; Wiser's Legacy; Wiser's Deluxe Canadian; Wiser's Rye Mini; Wiser's Spiced Vanilla Mini; Beefeater Gin; Plymouth Gin; Plymouth Gin 6pak DNO; Plymouth Navy Strength Gin; Malibu Melon Margarita Cocktail; Malibu Tropical Mojito Cocktail In A Bag; Malibu Tropical Sea Breeze Cocktail; Kahlua Frozen Mudslide; Malibu Blue Hawaiian Cocktail; Malibu Caribbean Cosmo Cocktail In Bag; Malibu Rum Punch Cocktail In A Bag; Kahlua RTD White Russian; Malibu Rum Punch in a Bag; Malibu Carribean Cosmo Light Cocktail in a Bag; Malibu Pina Colada Light Cocktail; Kahlua Rtd White Russian DNO; Hiram Walker Peppermint Schnapps; Absolut Citron (lemon Vodka); Absolut Grapevine Mini; Absolut Cherrykran Mini; Absolut Mini Bar; Absolut Mandrin; Absolut Raspberri; Absolut Apeach; Absolut Peppar; Absolut Ruby Red; Absolut Vanilia; Absolut Miami; Absolut Pears; Absolut Mini Trial Pack; Absolut Cherrykran; Absolut Kurant; Absolut Berri Acai; Fris Orange; Absolut Mango Vodka; Oddka Apple Pie; Absolut Grapevine; Absolut Cilantro; Absolut Wild Tea; Oddka Salted Caramel Popcorn; Fris Citrus; Absolut Chicago; Absolut Orient Apple; Absolut Hibiskus; Oddka Electricity; Absolut Texas; Absolut Citron; Absolut Cilantro Mini; Absolut Hibiskus Mini; Martell Vs; Martell Vsop Cognac; Azteca De Oro Brandy; Martell Cordon Bleu 12; Presidente Grape Brandy (pedro Domecq); Don Pedro Reserva Especial Brandy; Hiram Walker Orange Curacao 30prf; Hiram Walker Orange Curaco; Hiram Walker Mama Walkers Maple Bacon; Hiram Walker Blue Curacao; Hiram Walker Orange Curacao; Mama Walkers Maple Bacon; Mama Walkers Blueberry Pancake; Hiram Walker Black Raspberry; Becherovka Liqueur; Pernod Anise Liqueur; Ricard Anise Liqueur; Aalborg Akvavit Danish Liqueur - DNO; Soho Lychee; Hiram Walker Whipped Cream; Hiram Walker Whipped Cream Mini; Seagram's Twisted Peach Gin; Malibu w/Dole Pineapple Juice Giant Tray Pack; Jameson Gold Reserve(listed); The Glenlivet 12yr Sing Malt Scotch; Hiram Walker Crm De Menthe Green 3 Pak; Chivas Regal 18YR Tin HA; Scapa 16yr Sing Malt Scotch; Midleton Rare; Hiram Walker Apricot Brandy; Kahlua Midnight w/Shot Glass; Fris Blueberry Vodka; Fris Cherry Vodka; Level Imported Vodka DNO; Chivas Regal 25 Year Old; Lot 40; Martell Vs Cognac; Hiram Walker Crm De Banana; Hiram Walker Melon Liqueur; Redbreast  Cask Strength; Seagram's Twisted Pineapple Gin; Malibu Winter Edition; Hiram Walker Crm De Cacao White; Seagram's Red Berry Twisted Gin; Powers 12yr Irish Whiskey; Glenlivet Nadurra Triumph 1991; Jameson Irish Whiskey Minis; Jameson Vintage Reserve; Seagram's Distillers Reserve Gin; Wiser's 18 Year Old; Beefeater ""24"" Gin; Fris Orange Vodka; Martell Cordon Bleu 6pak Cognac; Hiram Walker Blue Curacao 3pak; Pernod D'absinthe; Seagram's Grape Twisted Gin; Kahlua Mocha; Strathisla 12yr Sing Malt Scotch; Paddy's Irish Whiskey; Hiram Walker Crm D Cacao Brown; Hiram Walker Creme De Cacao White 3pak; Hiram Walker Creme De Noyaux(dno); Beefeater ""24""; Monkey 47; Hiram Walker Creme De Cassis; Hiram Walker Kirschwasser; The Glenlivet Founders Reserve; Power's Gold; Seagram Blue Beast Gin & Juice; Absolut Black 100; Oddka Vodka; Chivas Regal 18yr Scotch; Ballantines Finest; Hiram Walker Caramel Apple Liqueur; The Glenlivet 21yr Archive; Seagram's Gin & Juice Tropical Thunder; Kahlua Rtd Raspberry White Russian; Oddka Wasabi; Seagrams Grape Twisted Gin; Hiram Walker Crm De Cacao Dark 3pak; Malibu Tropical Mojito Cocktail; Oddka Fresh Cut Grass; Seagrams Grape Twisted Gin Flask; Chivas Regal; Martell Xo Supreme; Hiram Walker Mama Walkers Blueberry Pancake; Hiram Walker Mango Schnapps; Hiram Walker Raspberry Schnapps; Seagram Tropical Gin & Juice; Hiram Walker Creme De Noyaux; The Glenlivet W/2 Glasses; Hiram Walker Sour Apple Schnapps; Hiram Walker Butternips Schnapps; Jameson Rarest Vintage Reserve HA; Hiram Walker Amaretto 3pk; Absolut Mandarin Vodka; Fris Vodka PET; Chivas Regal 25 Year Scotch; Hiram Walker Sloe Gin"
"PHENIX BRANDS, LLC",Shpilka Vodka
PHILLIPS BEVERAGE,"Phillips Vodka; UV Vodka PET; Cross Keys Rum Mini; SOOH Phillips Root Beer Schnapps; Cross Keys Rum; Revel Stoke Spiced; UV Sangria Mini; Tomatin Single Malt; Prairie Organic Vodka w/Mug; La Hechicera Aged Rum; Trader Vic's Macadamia Nut Liqueur; Trader Vic's Chestnut Liqueur; Phillips Raspberry Long Island Iced Tea; Phillips Rootbeer Schnapps; Tomatin Scotch Whisky Dualchas; Revel Stoke Roasted Pineapple Mini; Uv Vodka; Phillips Vodka Ez Pack; Ice Hole Cherry Schnapps; Douglas & Todd Bourbon Whiskey; Trader Vics Macadamia Nut Liqueur; Trader Vics 151  Rum; Phillips White Rum; Trader Vics Private Selection Spiced Rum; Phillips Long Island Iced Tea; UV Blue Raspberry Lemonade PET; Stinky Gringo Margarita; Uv Blue Raspberry Lemonade Pet; Finagrens Irish Whiskey; Finagrens Irish Whiskey Mini; Hell Cat Maggie; Row Vodka Mini; Row Vodka; UV Vodka; Prairie Organic Vodka; Phillips Vodka Mini; Waving Plains Vodka; Novaterra Organic Vodka; UV Candy Bar Mini; Hot Stuff; UV Cake Mini; Revel Stoke Rootbeer Mini; Revel Stoke Roasted Apple Mini; Revel Stoke Hot Stuff; Phillips Blackberry Brandy; Phillips Gin; Prairie Organic Gin; Phillips Root Beer Schnapps; Ice Hole Plum Schnapps; Ice Hole Butterscotch Schnapps; Ice Hole Mint Schnapps; SOOH Ice Hole Salty Caramel Schnapps; Phillips Hot 100 Cinnamon Schnapps; Phillips Sno Shoe Grog; Phillips Hot 100prf Cinnamon Schnapps; Revel Stoke Peanut Butter Whisky; Revel Stoke Peanut Butter Whisky Mini; Revel Stoke Peach Mini; Revel Stoke Cherry; Revel Stoke Cherry Mini; Revel Stoke Smoked Vanilla; Revel Stoke Blackberry Mini; Revel Stoke Roasted Pecan Mini; Revel Stoke Peach; Revel Stoke Roasted Pecan; Revel Stoke Roasted Apple; Revel Stoke Roasted Pineapple; Revel Stoke Blackberry; Revel Stoke Peanut Butter; Revel Stoke Smoked Vanilla Mini; Revel Stoke Rootbeer; Revel Stoke Honey; Revel Stoke Smoked Vanilla Whiskey; Revel Stoke Root Beer; Revel Stoke Smoked Vanilla Whiskey Mini; Revel Stoke Honey Whisky; Revel Stoke Honey Mini; Revel Stoke Root Beer Mini; Cabrito Reposado; UV Grape; UV Blue Raspberry; UV Red Cherry Mini; UV Blue Raspberry Mini; Uv Blue (raspberry) Vodka; UV Cake; UV Pink Lemonade; Uv Grape Vodka; UV Red Cherry; Phillips Lime Vodka; Uv Blue Raspberry Vodka Mini; UV Blue Raspberry PET; Phillips Lime Flavored Vodka; Uv Red (cherry) Vodka; Uv Cake Vodka Mini; UV Ruby Red Grapefruit Mini; UV Blue Raspberry Vodka Mini; Prairie Organic Apple Pear Ginger FL Vodka Mini; Uv Orange Vodka DISCO; UV Blue Raspberry Vodka; Uv Cake Vodka; Uv Cherry Red Vodka Mini; UV Cherry Red Vodka Mini; UV Cake Vodka; Prairie Organic Cucumber; UV Apple Green; Uv Ivory (vanilla) Vodka DISCO; Uv Citruv (citrus) Vodka DISCO; Uv Blue Raspberry Vodka Traveller; UV Chocolate Cake DISCO; Uv Green (apple) Vodka; UV Ruby Red Grapefruit; Uv Pink Lemonade Vodka; UV Sriracha; UV Peach DISCO; UV Candy Bar DISCO; UV Whipped DISCO; UV Sangria; UV Cherry Red; Prairie Organic Cucumber Vodka; UV Green Apple; Uv Ivory (vanilla) Vodka; UV Ivory Vanilla; UV Chocolate Cake Mini; Prairie Organic Grapefruit Hibiscus Chamomile FL Vodka; Prairie Organic Apple Pear Ginger FL Vodka; UV Candy Bar; UV Chocolate Cake; Prairie Organic Watermelon Cucumber Lime FL Vodka Mini; UV Salty Watermelon Mini; Uv Orange Vodka; UV Whipped; Broken Bell Bourbon Whisky; Trader Vics Chocolate Liqueur; Trader Vics Amaretto Liqueur; Mullins Irish Cream Liqueur; Quinns Irish Cream Liqueur; Union Rosies Irish Cream; Union Rosies Strawberry Cream; Revel Stoke 750ml w/Apple, Pecan & Pineapple 50mls; Revel Stoke Pumpkin Mini; Revel Stoke Root Beer w/Flask; Revel Stoke Pumpkin; Revel Stoke Canadian Whisky Cream; Phillips Peppermint 80prf Schnapps; Marca Negra Espadin; Tomatin Single Malt Scotch 18yr; Ice Hole Exotic Schnapps; Phillips Blackberry Flav Brandy; Ice Hole Salty Caramel Schnapps; UV Peach; Uv Citruv (citrus) Vodka; Prairie Organic Watermelon Cucumber Lime FL Vodka; Phillips Butterscotch Schnapps; Trader Vics White Chocolate; Tomatin Scotch Whisky 14 YR; Phillips Apricot Brandy; Revel Stoke Spiced Whisky; Centinela Anejo Tequila; Prairie Organic Grapefruit Hibiscus Chamomile FL Vodka Mini; Trader Vics Mai Tai; Phillips Brandy Fl Ginger; Phillips Schnapps Cinnamon Hot PET; UV Vanilla Ivory DISCO; Phillips Peppermint Schnapps; Revel Stoke Blackberry Whisky; Phillips Union Vanilla; Cabrito Blanco Tequila; Marca Negra Tobala; Revel Stoke Cinnamon; UV Orange; Ice Hole Root Beer Schnapps; Phillips Schnapps Rootbeer; Revel Stoke Straight; UV Silver Vodka; Revel Stoke Honey Whisky Mini; UV Salty Watermelon Mini DISCO; Tomatin Cu Bocan Scotch Whisky; Revel Stoke Hot Stuff Cinnamon Whiskey; UV Apple Green Mini"
PHILLIPS BEVERAGE COMPANY,Phillips Root Beer Schnapps; Ice Hole Butterscotch Schnapps; Ice Hole Salty Caramel Schnapps; Phillips Apricot Flav Brandy; Ice Hole Plum Schnapps; Phillips Hot 100 Cinnamon Schnapps; Phillips Blackberry Flav Brandy; Ice Hole Cinnamon Schnapps; UV Salty Caramel Apple; Revel Stoke Pumpkin; Revel Stoke Pumpkin Mini; Phillips Butterscotch Schnapps; Ice Hole Cherry Schnapps; Hell Cat Maggie; Phillips Black 100 Herbal Schnapps; Phillips Rootbeer Schnapps; Ice Hole Rootbeer Schnapps; Cabrito Reposado; Cabrito Blanco; Trader Vics Private Selection Spiced Rum; Phillips Vodka; Phillips Vodka Ez Pack; UV Vodka PET; Uv Vodka; UV Vodka; Prairie Organic Vodka; Uv Cake Vodka; Uv Blue (raspberry) Vodka; Uv Grape Vodka; Uv Blue Raspberry Vodka Mini; UV Cake Vodka; Uv Red (cherry) Vodka; Uv Cherry Red Vodka Mini; Phillips Lime Flavored Vodka; Uv Green (apple) Vodka; Uv Citruv (citrus) Vodka; UV Whipped Mini; UV Chocolate Cake Mini; UV Peach; Prairie Organic Cucumber; Uv Pink Lemonade Vodka; UV Salty Watermelon; Uv Ivory (vanilla) Vodka; UV Chocolate Cake; UV Candy Bar; UV Whipped; Uv Orange Vodka; UV Salty Watermelon Mini; Uv Blue Raspberry Vodka Traveller; UV Peach Mini; UV Candy Bar Mini; UV Ruby Red Grapefruit; UV Sriracha; UV Sugar Crush; Uv Coconut Vodka; King Solly White Grape Vodka; UV Sangria; UV Espresso Vodka; UV Espresso - DNO; UV Cherry Red; UV Cake; UV Ruby Red Grapefruit Mini; King Solly White Grape Vodka Mini; UV Sriracha Mini; UV Sugar Crush Mini; UV Sangria Mini; Uv Red(cherry) Vodka; Uv Sweet Green Tea Vodka; Hot Stuff; Hot Stuff Mini; Revel Stoke Spiced Whiskey; Phillips Gin; Prairie Organic Gin; Revel Stoke Roasted Pecan; Revel Stoke; Revel Stoke Roasted Pineapple; Revel Stoke Roasted Apple; Revel Stoke Roasted Apple Mini; Revel Stoke Roasted Pecan Mini; Revel Stoke Roasted Pineapple Mini; Revelstoke Spiced Canadian; Revel Stoke Mini; Phillips Long Island Iced Tea; Uv Blue Raspberry Lemonade Pet; Uv Pink Lemonade Cocktail Pet; Phillips Raspberry Long Island Ice Tea; Ice Hole Mint Schnapps; Phillips Peppermint 80prf Schnapps; Ice Hole Exotic Schnapps; Phillips White Rum; Trader Vic's Macadamia Nut Liqueur; Trader Vic's Chestnut Liqueur; Trader Vic's Chocolate Liqueur; Uv Blue Raspberry  Vodka Glass; Phillips Gin-Ka; Revel Stoke Spiced; UV Blue Raspberry Lemonade Bombsicle Cocktail Tray Pack; Phillips Sno Shoe Grog; Centinela Anejo Tequila; Rondiaz Spiced Rum; Phillips Union Vanilla; Phillips Union Whiskey; Phillips Union Cherry Flavored Whiskey; Uv 103; Centinela Blanco Tequila; Centinela Reposado Tequila; Trader Vic's Mai Tai; Tomatin Single Malt 12yr; Uv Blue Raspberry Minis; Uv Grape Vodka Minis; Cabrito Blanco Tequila; Uv Pink Lemonade Vodka Glass; Phillips Schnapps Herbal 100; Phillips Rootbeer Schnapps 100 Proof; Phillips Root Beer Schnapps 100 Proof; Trader Vic's Amaretto; Uv Pink Lemonade Vodka Mini; Revel Stoke Cinnamon; Phillips Blue 100 Peppermint Schnapps
PHILLY'S PREMIUM BEVERAGES LLC,Naked Ape Banana Egg Creme Liqueur
PHUSION PROJECTS LLC,Not Your Fathers Bourbon
PIEDMONT DISTILLERS,Midnight Moon Cherry; Midnight Moon Blackberry; Midnight Moon Apple Pie; Midnight Moon Strawberry; Midnight Moon Apple Pie w/Pourer & 2 Shot Glasses; Midnight Moon Blueberry; Midnight Moon Original; Midnight Moon Apple Pie w/ Drinking Jar; Midnight Moon Cranberry; Junior Johnson Cherry(do Not Use); Midnight Moon 100prf; Midnight Moon Peach Moonshine; Midnight Moon Raspberry; Junior Johnson Apple Pie Midnight Moon; Midnight Moon Apple Pie w/Drinking Jar; Junior Johnson Midnight Moon; Catdaddy Spiced Moonshine; Catdaddy Carolina Moonshine; Midnight Moon Peach; Junior Johnson Strawberry Midnight Moon; Midnight Moon Cinnamon
PIEDMONT DISTILLERS INC,Midnight Moon Cherry; Midnight Moon Original; Midnight Moon Apple Pie; Midnight Moon Dill Pickles; Midnight Moon Strawberry; Midnight Moon Blueberry; Midnight Moon Blackberry; Midnight Moon Cran-Apple Pie; Midnight Moon Watermelon; Midnight Moon Cinnamon; Midnight Moon Apple Pie 750ml w/100prf 50ml; The Clover Straight Bourbon; Midnight Moon American Whiskey; Midnight Moon Apple Pie 750ml w/100 Proof 50ml; Catdaddy Carolina Moonshine; Midnight Moon Raspberry; Midnight Moon Peach; Midnight Moon Cranberry; HA The Clover Straight Bourbon
PITTSBURGH DISTILLING COMPANY LLC,Wigle Whiskey Straight Wheat Whiskey; Organic Straight Pennsylvania Rye Whiskey
PRAIRIE CREEK BEVERAGES LLC,J.R. Ewing Private Reserve; Jackson Morgan Southern Creams Salted Caramel
PREMIER DISTRIBUTORS LLC,Gazdina Rakija Plum Brandy; Gazdina Rakija Pear Brandy; Gazdina Rakija Apricot Brandy; Gazdina Rakija Apple Brandy
PRESTIGE WINE & SPIRITS GROUP,Kinky Red Liqueur Mini; Kinky Liqueur Mini; Kinky Vodka; Mothers Schnapps Cherry; Glen Moray Elgin Classic Scotch Whiskey; Kinky Liqueur; Glen Moray Scotch Classic Port Cask w/2 Glasses; Glen Moray Scotch Classic Port Cask; Glen Moray Classic Chardonnay Cask Finish w/2 Glasses; Bison Ridge Canadian Whisky 8yr; Glen Moray Scotch Classic Port Cask Whisky; Kinky Red Liqueur; Ricura Mini; Kinky Blue; Glen Moray Sherry Cask; Glen Moray Cabernet; Kinky Blue Mini; Rondiaz Rum White Mini; SOOH Mothers Schnapps Cherry; Il Tramonto Amaretto; Opulent Vodka; Tomatin Single Malt; Rondiaz Rum White; Rondiaz Rum Spiced; Rondiaz Mini; Rondiaz Rum Spiced Black Cherry; Rondiaz DSS Lemon Rum; Rondiaz Spiced Apple; Rondiaz Rum Spiced Apple; Rondiaz Rum Spiced Apple Mini; Rondiaz Coconut Rum; Rondiaz Spiced Apple Mini; Ricura; Whistler Irish Cream; Dubliner Irish Whiskey; Whistler Honey Irish Whiskey; Whistler Double Oaked Irish Whiskey; Grays Peak Vodka; Kinky Vodka Mini; Grays Peak Vodka Mini; Members Mark Scotch Club Pack; Members Mark Scotch; Glen Moray; Dubliner Honeycomb Liqueur; Windsor Canadian PET; SOOH Windsor Black Cherry; Windsor Canadian; Opihr Gin; Kinky Green Mini; Kinky Liqueur Aloha Mini; Kinky Ruby Mini; Kinky Pink Mini; Kinky Pink; Kinky Aloha Mini; Kinky Red Mini; Kinky Mini; Kinky Green Liqueur; Kinky Green; Kinky Ruby Liqueur Mini; Kinky Red; Kinky Blue Liqueur; Kinky Aloha; Kinky Pink Liqueur; Kinky Green Liqueur Mini; Kinky Liqueur Aloha; Kinky Ruby Liqueur; Kinky Gold; Kinky Pride Pink Liqueur; Kinky Ruby; Kinky Naughty & Nice Red Liqueur; Il Tramonto Limoncello; Glen Moray 12YR w/2 Glasses; Rondiaz Rum White PET; Rondiaz Rum Spiced PET; Il Tramonto Limoncello w/2 Glasses; Glen Moray Elgin Classic Whiskey w/2 Glasses; Rondiaz Rum Spiced Black Cherry Mini; Rondiaz Rum Spiced Black Cherry PET; Glen Moray Elgin Classic; Athena Ouzo Rum; Gionelli Raspberry Grande; Glen Moray Classic Chardonnay Cask Finish; Wolfhound Irish Whiskey; Athena Liq Ouzo Rum; Merry's Irish Cream; Gionelli Triple Sec; Mothers Schnapps Butterscotch; HA Dubliner Irish Whiskey 10YR; Gionelli Schnapps Peach; Kinky Flame Cinnamon Whisky; Grays Peak Vodka Meyer Lemon; Rondiaz Gran Reserva Spiced Rum; Rondiaz Rum Dark
PRESTIGE WINE & SPIRITS GROUP / UNITED STATES DISTILLED PRODUCTS CO,Indoggo Strawberry Gin Mini; Indoggo Strawberry Gin; SOOH Mothers Schnapps Cherry; Rondiaz Rum Spiced; Rondiaz Rum Spiced Black Cherry; Rondiaz Coconut Rum; Whistler Irish Cream; Whistler Double Oaked Irish Whiskey; Whistler Honey Irish Whiskey; Grays Peak Vodka; Members Mark Scotch; Windsor Canadian; Windsor Canadian PET; SOOH Windsor Black Cherry; Kinky Pink Mini; Kinky Green Mini; Kinky Red Mini; Kinky Ruby Mini; Kinky Blue Mini; Kinky Pink; Kinky Blue; Kinky Aloha Mini; Kinky Fruit Punch Mini; Kinky Aloha; Kinky Green; Kinky Ruby; Kinky Fruit Punch; Kinky Red; Il Tramonto Limoncello; Il Tramonto Amaretto; Petri Five Star Brandy
PRESTIGE WINE AND SPIRITS GROUP,Kinky Vodka Martini Pack; Mothers Schnapps Cherry; Kinky Summer Pack w/2 375ml; Glen Moray; Tomatin Single Malt; Merrys Irish Cream Liqueur w/2 Glasses; Kinky Blue 375ml & Pink 375ml w/2 Shot Glasses; Merrys White Chocolate Liqueur w/2 Glasses; Opulent Vodka; Il Tramonto Limoncello; Rondiaz Rum Spiced; Opulent w/Shaker; Ricura Mini; Rondiaz Rum Spiced Black Cherry Mini; Rondiaz Spiced Rum; Rondiaz Rum Spiced Black Cherry; Rondiaz Mini; Rondiaz Coconut Rum; Ricacha Horchata; Ricura; Mothers Pumpkin Spiced Liqueur; Kinky Vodka; Opulent; Kinky Vodka Mini; Opulent Mini; Label 5; Opihr Gin; Kinky Blue; Kinky Blue Mini; Kinky Gold; Kinky Liqueur; Kinky Liqueur Mini; Rondiaz Rum White; Rondiaz Rum White Mini; Kinky Red Liqueur; Kinky Gold Mini; Kinky Red Liqueur Mini; Gioia Luisa Limoncello Lemon; Rondiaz Vanilla Rum; Mothers Schnapps Peppermint; Rondiaz Diaz Lemon Rum; Gionelli Peach Schnapps; Feckin Irish Whiskey; Glen Moray Scotch 25 YR Portwood HA; Bison Ridge Canadian Whisky 3yr; Bison Ridge Canadian Whisky 8yr; Wolfhound Irish Whiskey; Rondiaz Gran Reserva Spiced Rum; Trader Vic's Kahana Bay Dark Rum; Rondiaz DSS Lemon Rum; Merry's White Chocolate; Tomatin Single Malt Scotch 18yr; Tomatin Scotch Whisky 14 YR; Merry's Irish Cream
PRICHARDS DISTILLERY INC,Prichard's Sweet Lucy; Benjamin Prichards Double Barreled Bourbon; Prichards Sweet Lucifer; Prichards Sweet Lucy; Sweet Lucy; Benjamin Prichard''s Double Chocolate Bourbon Whiskey; Prichard's Fine Rum; Benjamin Prichard''s Sweet Lucy Cream
PROST BEVERAGE COMPANY,Tim Smiths Climax Moonshine; Tim Smith's Climax Moonshine; Tim Smith's Climax Fire #32; Climax Wood-Fired Whiskey; Climax Moonshine; Climax Fire No. 32; Climax Wood-FIred Whiskey w/2 Glasses; Tim Smith Southern Reserve Whiskey; Climax Fire No 32 Cinnamon Spice; Tim Smith Southern Reserve Bourbon; Tim Smith Southern Reserve Rye
